,,Question,Réponse
1,FAQ12-1,L'arbre de l'illustration un est-il un peuplier ?,Non.
2,FAQ12-2,"Sur les illustrations situées la nuit, le personnage est-il en plein rêve ?",La réponse est que non. Il n'est pas en rêve. Il est même malheureusement actif.
3,FAQ12-3,"“A l’Orient tu verras par l'autre trésor”, est-ce que “Orient” aurait pu s’écrire sans majuscule ?","Oui, tout à fait."
4,FAQ12-4,"Le dessin sur le rocher à l'illustration cinq qui pourrait faire penser à un “T”, est-ce une libre initiative de l'artiste ou est-ce que ça faisait partie du cahier des charges ?","Là-dessus, je préfère ne pas répondre."
5,FAQ12-5,Est-ce qu'une faucille en rouge a sa place dans le jeu ?,La réponse est non.
6,FAQ12-6,Est-ce que l’illustration quatre peut faire référence à quelque chose ou quelqu'un qu'on aurait volontairement effacé des mémoires ou voulu faire disparaître ?,"Non, pas à ma connaissance."
7,FAQ12-7,Le coup de pouce trois est-il lié à l'énigme deux ?,Non.
8,FAQ12-8,"Est-ce que, concernant l’énigme quatre, la charade est réalisable sans prendre en compte les illustrations ? Sans prendre en compte le titre de l'énigme ? Sans prendre en compte les nombres 1543 1938 ?","Alors là-dessus, je répondrais que tout se nourrit mutuellement. Voilà ce que je pourrais dire. Sinon, vous arrivez forcément à des résultats intermédiaires. Ce n'est pas une finalité en soi."
9,FAQ12-9,Les entailles craquelures de l'échiquier de l'illustration deux sont-elles à prendre en compte lors de notre chasse ou est-ce une liberté de l'illustratrice ?,"Non, il s'agit d'une liberté de l’illustratrice, donc ça n'a pas tellement d'importance."
10,FAQ12-10,"Pour l'énigme cinq, la pièce que nous recherchons a-t-elle été créée dans le but d'effectuer des transactions financières ? Ou alors a-t-elle été créée dans un but plutôt esthétique, comme une collection ou une œuvre d'art ?",La pièce a été principalement utilisée pour des transactions. C'est une pièce qui a été en circulation pendant une période assez longue et sur une zone suffisamment large pour qu'il y ait eu un grand volume de transactions.
11,FAQ12-11,Doit-on d'abord un peu avancer sur les différentes énigmes avant d'appréhender le poème ou pouvons-nous déjà tenter de le déchiffrer sans avoir résolu les énigmes ?,"Oui, vous pouvez avancer sur le poème, même au tout début du jeu."
12,FAQ12-12,Êtes-vous d'accord avec cette définition: “Les reliques sont les restes matériels qu'a ou qu’aurait laissé derrière elle en mourant une personne vénérée” ?,"Oui, ça me paraît une bonne définition de relique."
13,FAQ12-13,"Si vous deviez comparer cette chasse à un jeu existant, se rapprocherait-elle le plus d'un jeu de piste, d'un Cluedo ou d'un cache-cache ?","Alors, là-dessus, je dirais qu'il s'agit d'un jeu de piste évidemment, mais si on devait le comparer un jeu, plutôt un puzzle qui serait vraiment ancré dans l'histoire, dans l’ésotérisme, dans tout l'univers du Comte de Saint-Germain."
14,FAQ12-14,"Concernant l'énigme quatre, auriez-vous pu écrire “gardien des sceaux” au lieu de “garde des sceaux” ?","Je pense que oui. Mais dans la version française en tout cas, “garde des sceaux” est bien plus clair. Donc si c'était à refaire, je réécrirais “garde des sceaux” ça me semble plus clair."
15,FAQ12-15,"Sur l'énigme quatre et concernant les sceaux, est-ce que les sceaux gardés sont tous de même nature ?",La réponse est oui.
16,FAQ12-16,Est-ce que c'est plus l'endroit global où se trouve la grappe que la grappe elle-même qui a son importance dans l'histoire de France ?,Je dirais que les deux ont leur importance.
17,FAQ12-17,"De nouveau, parcourir la grappe va nous mener plus tard à un endroit précis. Cet endroit est-il très clairement indiqué dans l'un des visuels ?","Oui, tout à fait. Visuel et énigme écrite, c'est clairement indiqué."
18,FAQ12-18,Le lierre de la connaissance est-il un savoir-faire ou est-il dû à l'artisanat ?,Aucun des deux. Mais il fait référence à des points très précis.
19,FAQ12-19,Est-ce qu'une vraie bataille se joue sur l'échiquier ?,"Non, pas encore."
20,FAQ12-20,Vous avez dit qu'il était intéressant de savoir jouer au roi de la montagne. Cela fait-il référence au roi de la montagne du coup de pouce numéro un ? D'une pierre deux coups ?,"Oui, tout à fait. Même si par curiosité intellectuelle, je vous conseille de vous intéresser au roi de la montagne version échecs. C'est une perle à ne pas manquer."
21,FAQ12-21,"Nous conseillerez-vous aussi de jouer au roi de la colline, sachant qu’aux échecs il s'agit du même jeu que celui du roi de la montagne ?","Oui, tout à fait. Vous pouvez jouer au roi de la colline. Roi de la cime, roi de la colline, roi de la montagne. Les trois sont intéressants."
22,FAQ12-22,"Hormis le fait qu'ils cachent les voyelles, les pictogrammes sont-ils une aide précieuse pour trouver le bonus de la grappe ?","Là-dessus, je ne répondrais pas."
23,FAQ12-23,Le lierre de la connaissance est-il composé d'entités ?,"Oui, en quelque sorte."
24,FAQ12-24,Peut-on trouver la chambre cachée sans avoir trouvé le lieu familier ?,Oui.
25,FAQ12-25,Le lieu de la cache est-il défini de façon précise par l'intersection d'au moins deux tracés ?,Ça me semble un peu trop précis. Je ne répondrais pas.
26,FAQ12-26,La montagne de l'illustration trois est-elle aussi un chevalier ?,Je ne peux pas répondre à cette question.
27,FAQ12-27,"Peut-on dire que d'une certaine manière, et bien malgré lui, le Prince des Vignes est en lien avec l’un des maux rencontrés lors de la quête de l’Elixir ?","Non, je ne crois pas."
28,FAQ12-28,Une lettre grecque peut-elle être intéressante à observer pour VITRIOL hors utilisation mathématique ?,Non.
29,FAQ12-29,Les couleurs des drapeaux sur l'illustration quatre ont-elles un rapport avec les chevaliers des échecs ?,Je ne peux pas répondre sur un lien aussi direct que vous tissez.
30,FAQ12-30,Les entités de l'énigme deux ont-elles existées réellement ?,Je peux pas répondre à cette question.
31,FAQ12-31,Les noms des entités de l'énigme deux sont-ils leurs vrais noms ou juste des pistes pour trouver les vrais ?,Je peux pas répondre à cette question.
32,FAQ12-32,Y a-t-il dans les visuels des éléments nous permettant d'identifier précisément les entités de l’énigme deux ?,"Oui, en partie. Les visuels peuvent aider."
33,FAQ12-33,La rose des vents du visuel un peut-elle nous aider pour l’énigme deux ?,Non.
34,FAQ12-34,Les serpents du visuel quatre jouent-ils ? Font-ils référence à un objet se trouvant dans la pièce ?,"Non, ils ne jouent pas. Ils sont immobiles. Il s'agit de statues."
35,FAQ12-35,L'identité de la personne qui repose dans la chambre cachée est-elle formellement connue ?,"Oui, tout à fait."
36,FAQ12-36,L'énigme trois m'encourage à inspirer entre deux hululements. Suis-je sur la bonne piste ?,"Non, je ne crois pas. Mais ça a l'air chouette."
37,FAQ12-37,Suis-je sur la bonne piste de l'énigme deux si je vous dis R.POULIDOR.CONTRARIUM.EST ?,"Mon grand-père était fan de [Raymond] Poulidor. Je crois qu'il n’a jamais gagné le Tour, le pauvre. Mais là-dessus, je suis plus que novice en la matière. Donc je ne saurais pas vous répondre précisément."
38,FAQ12-38,"Au cours des FAQs et de la recherche de la chambre cachée, on est passé du terme ""élément à trouver dans cette chambre"" à ""objet qui définirait le point de départ du lierre de la connaissance"". Un écrit sur un mur fait-il référence à cette notion d'élément ou d'objet ?","C'est une excellente remarque, mais je ne peux pas répondre à cette question."
39,FAQ12-39,Cet élément-objet nous amène-t-il à avoir des connaissances sur un certain voyage dans les ténèbres ?,"Très bonne question, mais je ne peux pas y répondre."
40,FAQ12-40,La pierre d'attente était-elle initialement dans la chambre cachée ?,"Non, elle est bien loin de la chambre cachée."
41,FAQ12-41,A-t-elle voyagé [ndr: la pierre d'attente] au cours du temps depuis la redécouverte de la chambre cachée ?,"Non, elle n’a jamais bougé."
42,FAQ12-42,Est-ce que seule la personne qui a les yeux clos dans la chambre peut voir et monter sur la pierre d'attente ?,"Si on extrapole, la personne qui a les yeux clos aurait pu y monter. Mais on n’a pas dû y rester bien longtemps."
43,FAQ12-43,"Lors de la redécouverte de la chambre cachée, était-elle intacte ou a-t-elle été visitée depuis qu'elle a été cachée ?",Je pourrais pas vous dire. Je n'ai pas l'information.
44,FAQ12-44,Le décor de la voute de la chambre cachée diffère-t-elle des autres chambres du même type ?,"Alors tout ce que je peux dire, c'est que la chambre est assez unique dans sa décoration."
45,FAQ12-45,"Vous connaissez probablement la lumineuse formule de notre célèbre philosophe contemporain Jean-Claude: ""1+1=1"". Peut-elle s'appliquer par moment à la chasse ?","Non, là-dessus, je ne pense pas que Van Damme pourra vous être utile. Malheureusement."
46,FAQ12-46,La Fontaine de Jouvence peut-elle nous aider dans notre quête ?,"Je ne peux pas répondre à cette question.
"
47,FAQ12-47,"A propos des cavaliers de l'illustration deux, et sans parler de couleur hexadécimale, peut-on imaginer que la nuance de vert et la nuance de rouge choisies puissent ultérieurement servir de confirmation à quelque chose ?","Je pourrais pas dire clairement sur les nuances, à part vous confirmer qu'il s'agit d'un vert plutôt pâle. Voilà ce que je pourrais dire."
48,FAQ12-48,Quel passage de l’ouvrage de Dante nous recommandez-vous de lire ?,"Là-dessus, c'est un peu trop précis. Je ne pourrais pas donner d'éléments."
49,FAQ12-49,Une petite montagne à trois croix a-t-elle son importance dans la chasse ?,C'est une bonne question et je pense que vous devriez aller au bout de cette piste si vous l’explorez.
50,FAQ12-50,Faust peut-il nous être utile ?,Oui.
51,FAQ12-51,"Au cours de notre quête, pourrions-nous être amenés à aller jusqu'au bout du monde ?",Vous pourriez être amenés jusqu’au Nouveau Monde. Mais je ne pense pas que vous auriez besoin d'aller jusqu'au bout du monde.
52,FAQ12-52,"Appliqué à notre quête, serait-il juste de dire que la fuite est parfois la meilleure option ?","Non, je ne pense pas. Au contraire, vous ne devriez pas fuir."
53,FAQ12-53,Est-ce que les fanions blanc et rouge du visuel quatre sont apparus simultanément ou à des intervalles éloignés ?,Ils sont apparus simultanément.
54,FAQ12-54,Les cendres à relier croisent-elles le lieu familier ?,"Ça, je pourrais pas répondre."
55,FAQ12-55,Les cavaliers de l'échiquier sont-ils des chevaliers ?,"Alors oui, on peut les appeler comme ça. D'ailleurs, dans d'autres langues que le français, c'est le même terme qui désigne chevalier et cavalier. Par exemple en anglais, c’est le terme de “Knight”. Donc oui, tout à fait."
56,FAQ12-56,Les trois points sur l'illustration six à droite du centre de l'astre de feu font-ils partie du cahier des charges ?,"Non, ça ne fait pas partie du cahier des charges, donc c'est une liberté de Mathilde là-dessus."
57,FAQ12-57,Le rapporteur a-t-il été minutieusement positionné par rapport à d'autres éléments de l'image ?,"Là-dessus, je ne peux pas répondre."
58,FAQ12-58,"L'objet qui se trouve dans la chambre cachée a-t-il été posé par une personne que le Comte connait ? Et cet objet était-il justement destiné seulement au Comte ? L'objet de la chambre caché se trouve-t-il présent depuis la création de la chambre ou est-ce postérieur ? De plus, se trouve-t-il toujours dans cette chambre cachée à notre époque ?","L'élément dans la chambre cachée était là bien avant le Comte. Et, ce que je peux dire, ce qu'il y est a priori, toujours aujourd'hui."
59,FAQ12-59,Nous avons trois références à un engagement passé. Pourrait-il y en avoir un quatrième qui serait en lien avec le fil rouge ?,"Alors je n'ai pas compté et je ne sais pas à quoi fait référence un engagement passé précisément. Donc, là-dessus, je pourrais pas répondre précisément."
60,FAQ12-60,Êtes-vous d'accord avec cette expression: “Le diable se cache dans les détails” ?,"Oui, plutôt."
61,FAQ12-61,"A choisir un objet fétiche ou un porte bonheur, le Comte de Saint-Germain serait-il plutôt patte de lapin, patte d'oie ou patte d'éléphant ?",Je dirais plutôt patte de lapin.
62,FAQ12-62,"Riri, Fifi ou Loulou étaient-ils adeptes d'une forme de covoiturage ?","Non, ils n'étaient pas adeptes de covoiturage."
63,FAQ12-63,"Vous connaissez sans doute ce proverbe “Il vaut mieux avoir affaire à Dieu qu'à ses Saints”. Dans le cadre de la chasse, pourrais-je faire une entorse à celui-ci et m'adresser d'abord aux Saints ?","Oui, c'est une bonne question et la réponse est oui. Tout à fait."
64,FAQ12-64,"Les couleurs rouges et blanches des fanions sont-elles associées à un ou plusieurs symboles d'identité, de puissance et d'autorité ?",En partie oui.
65,FAQ12-65,"Serait-il erroné de penser qu'à un moment donné, voire précis, notre parcours serait fléché (par une flèche) ?",Non. Il n'y a pas de parcours fléché.
66,FAQ12-66,Le Comte est-il un farceur ?,"Toutes proportions gardées, oui, la personnalité du Comte est plutôt facétieuse. Donc je dirais que c'est un farceur."
67,FAQ12-67,Les fanions rouges et blancs font-ils référence à une ville ?,Je peux pas répondre à cette question.
68,FAQ12-68,Les fanions rouges et blancs font-ils référence à des personnes ?,"Je peux pas répondre à cette question. C'est à vous de comprendre à quoi peuvent faire référence, alors je dirais pas forcément fanions, mais les étendards. Mais oui, ou fanion c'est bien aussi, mais c'est à vous de savoir à quoi ça peut faire référence."
69,FAQ12-69,"Dans la FAQ 10, vous avez dit que le personnage abandonne l'épée, je cite: “parce qu'il n'est pas encore digne de l’avoir et qu'il ne peut pas en quelque sorte s'en servir”. Est-ce que c'est parce que le personnage aurait découvert une vérité ? Ce qui l'a rendu digne et qu'il a pu se servir de l'épée ?","Là-dessus, ça me semble trop précis pour que je puisse répondre."
70,FAQ12-70,"Dans l’énigme cinq, une référence à Pythagore peut-elle nous permettre de faire le bon compte ?",Je peux pas répondre à cette question. C’est trop précis.
71,FAQ12-71,Le lierre de la connaissance est-il intéressant par la forme de ses feuilles ?,"Non, pas vraiment."
72,FAQ12-72,"La pierre d'attente est-elle plus à caractère religieux, politique ou culturel ? De plus, si elle a été choisie parmi d'autres, les autres sont-elles toujours au même endroit où la pierre d'attente se trouve ? Et si oui, est-ce que je peux, du coup, faire un mauvais choix parmi toutes ces pierres ?","Sur la première partie religieux, politique ou culturel, ça je ne répondrais pas. Sur le reste, oui, elle a été choisie parmi une multitude de pierres d'attente. Y en a énormément. Par contre, une fois la cinq décryptée, vous n'aurez aucun doute sur le choix de la bonne pierre."
73,FAQ12-73,"Quand vous dites qu'il ne vaut mieux pas s'asseoir sur la pierre d'attente, est-ce que vous parlez au sens propre ?","Vous pouvez vous asseoir sans rien risquer sur la pierre d'attente, mais c'était plutôt au sens figuré, car il n'est jamais de bonne augure de s'asseoir dessus."
74,FAQ12-74,Combattre le mal n’est pas qu’un affrontement envers nous-mêmes ? ,"Il y a un vrai affrontement, un vrai combat."
75,FAQ12-75,Est-ce que vous parlez au niveau historique [ndr: par rapport au combat contre le mal] ?,"Historique, c'est un bien grand mot, mais l'affrontement en lui-même n'est pas imaginaire. C'est un affrontement qui est bien réel, même documenté. Qui a été longuement et abondamment commenté en tout cas."
76,FAQ12-76,La pierre d'attente a-t-elle été utile à une cérémonie funéraire ?,Je ne peux pas répondre à cette question.
77,FAQ12-77,Les runes du visuel deux ont-elles un lien graphique avec l'élément perturbateur ?,Je ne peux pas répondre à cette question qui est trop précise.
78,FAQ12-78,"Les lettres rouges du poème, les lettres rouges de l'indice, la phrase en rouge dans deux énigmes ainsi que les chiffres vont-ils ensemble pour une même crypto ?","Oui, en effet, la couleur rouge a une cohérence globale qu'il faut déterminer à un moment important du jeu."
79,FAQ12-79,L’arbre de l'illustration un a-t-il déjà été utilisé pour des constructions importantes telles que des temples ?,La réponse est non.
80,FAQ12-80,Sommes-nous à un moment précis guidés vers Thulé ? Devons-nous ouvrir les yeux et voir quelque chose durant ce périple ?,"Là-dessus, je ne peux pas répondre."
81,FAQ12-81,"Après le dernier cercle de l'énigme trois, le dernier ciel dans l'énigme six ?",Je ne dirais pas que c'est le dernier. Je dirais plutôt que c'est le début d'un nouveau ciel.
82,FAQ12-82,Est-il nécessaire d'avoir ou d'acquérir des connaissances supérieures aux bases apprises au collège par exemple ?,"Oui, ça me semble nécessaire."
83,FAQ12-83,"Les quatre cavaliers de l'échiquier sont-ils des points à placer sur une carte qui doivent former un carré, ou un losange et être équidistants ?","Là-dessus, je ne peux pas répondre malheureusement."
84,FAQ12-84,Le poème nous fait-il traverser les siècles en nous racontant une histoire ?,"Oui, tout à fait. Le poème vous raconte une histoire qui s'échelonne sur un temps assez long."
85,FAQ12-85,Décrypter 3C64 nécessite-t-il d'accéder à un savoir encyclopédique ?,"Non, pas du tout."
86,FAQ12-86,Nous conseillez-vous de nous intéresser à la ville de Boston ?,"Je ne peux pas répondre, c'est trop précis."
87,FAQ12-87,"“Vos premiers guides”, si vous utilisez la notion de “premiers guides”, cela implique-t-il que des seconds guides apparaîtront plus tard ? Et si oui, devrais-je fonctionner de la même manière qu'avec les premiers guides ?","Sur la première partie, oui, sans doute. S’il est fait mention de premiers guides, c'est surement, parce que d'autres suivront. Sur la seconde question, je ne peux pas répondre."
88,FAQ12-88,Connaître l'endroit très précis où se trouve le personnage sur le visuel un a-t-il une importance ?,Non.
89,FAQ12-89,Avons-nous rencontré un ou des éléments constitutifs de la Trinité avant d'aborder INRI ?,"Oui, tout à fait."
90,FAQ12-90,"En FAQ 11, vous avez dit que pour résoudre l’échiquier, il fallait chercher d'autres éléments textuels dans les énigmes ou tout le parchemin. Il y a six pièces qui ont été bougées sur l'échiquier. Il y a six énigmes numérotées. Est-ce un hasard ? De plus, même s'il y a six pièces qui ont été bougées à l'instant où l'on regarde, y a-t-il six coups joués ? Moins ou plus ?","Sur le hasard, je ne pourrais pas vous dire, mais je vous confirme en effet que six coups ont bien été joués."
91,FAQ12-91,"Deux fanions se trouvent dans l'illustration quatre, rouge et blanc. Est-ce que le nom “drapeau” est le plus adapté ou devrait-on plutôt parler de “pavillon” ?","Non, fanion c'est bien. Le terme d'étendard aussi me paraît correct. Ce n'est pas d'une importance cruciale. Mais les deux termes sont bons."
92,FAQ12-92,Concernant le jeu de Faro: doit-on s'intéresser à l'autre nom de ce jeu pour nous orienter ?,Je ne peux pas répondre parce que l'élément auquel vous faites allusion n'est pas en clair.
93,FAQ12-93,"Pour nous aider dans son utilisation [ndr: le jeu de Faro], doit-on s'intéresser à un autre Comte et d'un bateau ou aux origines de ce jeu ?",Je peux pas répondre.
94,FAQ12-94,La conquête de l'Ouest rime avec Faro dans les casinos de l'époque. Me conseilleriez-vous fortement de regarder dans cette direction ?,"Pour le coup, la conquête de l'Ouest me semble un peu anachronique. Donc non, je vous conseillerais pas particulièrement de pousser cette piste."
95,FAQ12-95,"Peut-on être mené vers la pierre d'attente dans un monde parallèle grâce à des repères géographiques indiqués par le mal jumeau ? Par exemple, dans un monde où on pourrait voyager du lieu A au lieu B. Tandis que dans son monde parallèle, le trajet serait du lieu A prime au lieu B prime.","La notion de report de repère, de tracé, oui, me semble intéressante à explorer dans le cadre de la chasse. Mais sans doute pour d'autres aspects du jeu. Et je ne parlerais pas forcément de mondes parallèles."
96,FAQ12-96,Est-il intéressant de revenir sur l'échiquier vers la fin une fois certains rapprochement fait avec des pièces du jeu et notre cheminement pour que tout s'éclaire ?,Je ne peux pas répondre à cette question.
97,FAQ12-97,Un animal aquatique peut-il nous aider à trouver un élément de l'Elixir ?,Alors il ne pourra pas vous aider. Mais il y a bien un animal aquatique dans le jeu.
98,FAQ12-98,Ce lieu qui m'est familier peut être considéré comme une sorte de jumelage ? Comme il en existe toujours de nos jours entre villes ou villages ayant des liens historiques ou autres.,"Oui, c'est possible. Le lieu peut en effet être familier de plusieurs façons, y compris de celle-là."
99,FAQ12-99,Y a-t-il une question qui vous paraît évidente pour avancer dans le jeu mais qui ne vous a jamais été posée ?,"Oui, plusieurs. Mais je n'aurais sans doute pas pu y répondre. Donc ça aurait pas forcément fait beaucoup avancer les choses."
100,FAQ12-100,"Enigme quatre, la charade a une solution unique. En est-il de même pour les différents items ou peuvent-ils avoir plusieurs réponses selon le fil rouge choisi ?","Oui, les items ont une solution unique lorsqu'on suit la bonne piste. Oui, tout à fait."
101,FAQ12-101,Les premiers guides sont-ils plus à considérer de manière “guides spirituels” car ils ont réellement existé ? Donc ils servent de manuel d'enseignement à suivre ?,"Alors là-dessus, je pourrais pas répondre."
102,FAQ12-102,"Pour rencontrer [les premiers] guides et apprendre à les connaître, y a-t-il des conditions préalables, comme par exemple être un chevalier, ou est-ce accessible à qui le souhaite ?","A priori, c'est accessible à tout le monde."
103,FAQ12-103,"Parmi les expressions suivantes, lesquelles vous sembleraient pertinentes dans la chasse ? Petit a, jeter de l'huile sur le feu ? Petit b, mettre de l'eau dans son vin ? Petit [c], remuer ciel et terre ? Ou petit d, n'avoir l'air de rien ?",Je répondrais Petit B: Mettre de l'eau dans son vin.
104,FAQ12-104,"La Trinité est-elle accompagnée ou en lien avec un quatuor ? Et si oui, sont-ils de même nature Trinité et quatuor ?","Non, la Trinité est unique. Et elle n'a pas d'équivalent. Voilà ce que je pourrais dire."
105,FAQ12-105,"Le cheval de Troie à une ouverture, mais où est passée sa trappe ?","Non, ce n’est pas important."
106,FAQ12-106,"La couleur des rochers du visuel cinq est différente, grise pour les uns et beige pour les autres. Et l’un des petits palmiers du visuel cinq semble avoir un tronc inexistant couleur terre. Liberté de l’artiste ou respect du cahier des charges ?",Liberté de l'artiste.
107,FAQ12-107,Le personnage barbu aurait-il pu lâcher l’épée ailleurs dans le visuel cinq ?,"Ailleurs sur le chemin: oui. Mais il était important qu'il la lâche, on va dire, au seuil, à l'approche du bâtiment uniquement."
108,FAQ12-108,"Dans l'énigme six, la lueur qui brille dans le noir pourrait-elle être qualifiée d'étincelle et/ou de reflet ?","En effet, une étincelle me semble assez proche. Donc oui."
109,FAQ12-109,"Quand vous dites qu'il ne vaut mieux pas s'asseoir sur la pierre d'attente, vous parlez par superstition ou au sens propre ?","Du coup, plutôt par superstition, au sens figuré."
110,FAQ12-110,La découverte du cheval vert a-t-elle quelque chose d'insolite ?,"Non, je n'emploierais pas le terme d'insolite."
111,FAQ12-111,Devons-nous trouver une quatrième entité qui soit différente du quêteur ?,Je ne peux pas répondre à cette question.
112,FAQ12-112,"J'étudie un peu les différentes méthodes de déchiffrement. [...] Là, je m'informe sur la machine Enigma et le chiffre de Hill qui me paraissent un peu complexe. Dois-je persévérer ? Ou alors il n'y a pas besoin de sortir de Saint-Cyr pour résoudre des cryptos de la chasse ? ","Je vous comprends tout à fait. Puisque j'ai eu beaucoup de mal à comprendre aussi comment fonctionnait les rotors de la machine Enigma. Ça me parait très complexe. Donc, ce que je pourrais vous dire c'est que les cryptos utilisés ne sont pas des cryptos inconnus ou niche. La chasse fait vraiment la part belle à des cryptos très classiques pour cet aspect du jeu, pour justement ne pas favoriser les experts en cryptographie. Mais je vous invite quand même à vous renseigner sur les méthodes de base, sur les méthodes les plus importantes de l'histoire de la cryptographie. Parce que la chasse comporte quand même de la crypto."
113,FAQ12-113,La chambre cachée est-elle spéciale à cause de la décoration murale et en lien avec les hiéroglyphes de l’illustration deux ? L'objet à trouver dans la chambre cachée est-il encore présent actuellement dedans ou se trouve-t-il ailleurs ?,"Oui, l'élément y est toujours. Après, je ne peux pas dire en quoi la chambre est spéciale. Ca donnerait un peu trop d'indices."
114,FAQ12-114,La chambre cachée a-t-elle été fermée pendant une longue période pour sa préservation et sa restauration ?,"Je n'ai pas les informations exactes, mais c'est très probable. Oui."
