,,Question,Réponse
201,FAQ10-201,"Certains éléments des énigmes semblent ne pas être politiquement corrects (Vu de notre époque cher Comte, bien entendu), est-ce moi qui est l’esprit mal tourné ou vous qui faites preuve d'une grande liberté de ton?","La chasse est ouverte aux majeurs uniquement donc, à partir de là en effet, vous pouvez vous autoriser à toutes les pistes. Je dirais que pour résoudre les énigmes, il ne faut pas être un être immoral, au contraire. Là-dessus, pas d'inquiétude, la chasse ne va pas vous forcer à devenir une mauvaise version de vous-même. Mais en tout cas, il est possible que les thèmes abordés à travers le jeu ne soient pas tous d'une grande vertu."
202,FAQ10-202,"Dernière question à propos “d'esprit mal tourné” [ndr: FAQ10-201], cette expression d'une certaine façon pourrait-elle qualifier notre personnage barbu?","Oui, en effet."
203,FAQ10-203,Pouvons-nous penser que la grappe de raisin soit un concept touristique?,"Non. Ensuite, de loin, on pourrait dire que oui."
204,FAQ10-204,"Vous avez précisé que nous étions au crépuscule dans l'illustration numéro une. Le soleil dans sa course, va-t-il aller vers la gauche ou vers la droite?","Dans l'illustration une, il s'agit d'un ciel rose et donc d'un coucher de soleil. Il se couche dans le sens où le soleil se couche traditionnellement [dans l'hémisphère Nord]."
205,FAQ10-205,Les cendres à relier sont-elles celles des hommes après leur chute?,"Oui, tout à fait."
206,FAQ10-206,La grappe sentirait-elle l'eau de Cologne?,"Si c'est une nouvelle référence à Napoléon je vous dirais que non. Sinon, je ne pense pas qu'elle sente l'eau de Cologne."
207,FAQ10-207,"Le cavalier noir au blason joue-t-il la partie d'échecs avec sa couleur, les noirs ou bien coté blanc?","Le cavalier noir joue ""contre son camp"". Il joue pour les blancs en l'occurrence dans le visuel."
208,FAQ10-208,Le cavalier noir a-t-il effectué un seul mouvement depuis le début de la partie?,"Là-dessus, je ne pourrais pas vous répondre. De même pour les trois autres cavaliers, je ne pourrai pas vous répondre. Mais on est, en effet, dans une configuration assez singulière qui peut être identifiée sur les principales ouvertures que vous pouvez trouver au jeu d'échecs."
209,FAQ10-209,"Vous nous avez dit: premier, on pourrait remplacer “de bon aloi” par “fidèle”, cinquième remplacer “jeune” par “petit”. Sans changer le résultat de la charade pourrait-on remplacer “de bon aloi” par de “pyramides” (1)? “Jeune” par “joyeux” (2)? “sceaux” par “prisons” (3)?""l'aigle"" par ""l'homme"" (4) ?
","(1) Non, on pourrait pas. (2) Non plus. (3) On ne pourrait pas non plus. Quoique, je vous l’autoriserais plus volontiers que pour les deux premières propositions. Mais c'est vraiment garde des sceaux. Et le terme “sceau” aurait pu difficilement être remplacé. (4) Non, il s'agit bien d'un aigle."
210,FAQ10-210,"Riri, Fifi et Loulou sont, comme nous le savons, de fins navigateurs. Devons-nous prendre la mer avant de profiter de leur expertise ou l’idée est qu’ils nous aident directement autour d’un bon verre?",Je pense que l'idée est plutôt qu’ils vous aident directement autour d'un bon verre.
211,FAQ10-211,"Vous avez dit qu’on ne pourrait pas suivre ces 3 navigateurs [ndr: Riri, Fifi et Loulou] et qu’il faudrait en choisir un, je dois avouer que j’ai mon préféré. Sommes nous d’accord que son navire me mène à multiples endroits ?","Je ne pourrais pas vous répondre, mais en tout cas, vous avez potentiellement une intuition qui pourrait être la bonne. Du coup, je vous ai répondu."
212,FAQ10-212,"L’un de ces navigateurs [ndr: Riri, Fifi et Loulou], discrets jusqu’alors, pourrait-il s’avérer d’une grande aide en fin de chasse?","Là-dessus, par contre, je ne vous répondrais pas, mais c'est une très bonne question."
213,FAQ10-213,"Dans le trou du visuel trois, y a-t-il véritablement la place d'y mettre deux personnes ou celui-ci est nettement plus petit?","Il y a la place, comme c’est représenté dans le visuel, de mettre deux personnes, mais pas de façon allongée. Deux personnes qui seraient plutôt assises."
214,FAQ10-214,La position de l'oiseau sur l’illustration une est-elle précise ou il aurait pu se trouver à un autre endroit?,L'oiseau aurait pu se trouver à un autre endroit.
215,FAQ10-215,Les hommes qui tombent peuvent-ils être associés au côté du mal?,Je pense que c'est une question qui est subjective et donc je vous répondrais en subjectivité que non.
216,FAQ10-216,"Dans INRI, la pierre qui est sur le feu est-elle la pierre d’attente ou une autre?",Il ne s'agit pas de la pierre d'attente.
217,FAQ10-217,Les quatre grappes de la première illustration nous laissent-elles entendre que nous devons identifier quatre vignobles pour cette énigme? Même question pour les trois grappes de l’illustration cinq?,Je vous dirais qu'il aurait pu y avoir plus ou moins de grappes donc ça n'a pas beaucoup d'importance.
218,FAQ10-218,"Dans l’énigme deux, les chevaliers me saluent plutôt d'une courbette ou d'un geste martial?","Vous faites référence à un élément qui n’est pas en clair. Pour cette raison, je ne pourrais pas répondre à la question."
219,FAQ10-219,"Si je vous dis que j'ai trouvé le mal, sans avoir encore eu besoin de jouer un coup au échec, me répondez-vous que c'est impossible?",Je pense que ce n’est pas impossible.
220,FAQ10-220,"Vous aviez dit que dans le monde il existait plusieurs grappes ressemblant à celle que l’on cherche mais qu’une seule est la bonne. De même, si on imagine que le mal est représenté sur la carte par quelque chose peut-il y avoir plusieurs mal équivalent dans le monde, mais un seul qui est le bon dans notre cas?","Il y a, en effet, plusieurs mals équivalents dans le monde et dans l'histoire. Mais un seul mal, un seul mal jumeau va être intéressant. Ensuite, il y a le mal en général, qu’il vous faut combattre, et là je dirais que c'est moins un lieu à identifier que quelque chose d'autre."
221,FAQ10-221,"Les deux phrases en rouge de l’énigme deux pointent-elles vers deux choses différentes? (un sans prendre en considération le fait qu'elles soient rouges, et un en prenant en compte cela)?","Là dessus, je ne pourrais pas vous répondre. Pareil pour le reste de la question. Une seule chose mais qui aura une autre importance avec d'autres éléments. Je ne peux pas m'aventurer à vous répondre là-dessus."
222,FAQ10-222,Si je vous dis que je pense avoir trouvé l'endroit où se tiennent les personnages dans l'illustration trois vous me répondez: a/ Bravo si c'est le bon. b/ Vous avez de l'imagination car ça ne pointe rien de particulier.,"Je pense que c’est “Bravo, si c'est le bon”. Il y a en effet un lieu précis où se tiennent les personnages dans l’illustration trois."
223,FAQ10-223,Existe-t-il une méthode commune à tous les visuels pour déterminer l’heure exacte qu’il est sur chacun d’eux?,"Pas vraiment, à part analyser les visuels. Vous n'avez pas besoin d'avoir une heure extrêmement précise. Là-dessus, je pourrais vous dire: le premier visuel c'est le soir, sur les trois suivants c'est la nuit, puis le matin et enfin le zénith sur l'illustration six."
224,FAQ10-224,"A propos du poème, chaque strophe correspond a un événement. Est-ce que le poème est conçu de manière chronologique pour que chaque strophe se suivent dans le temps?","Il y a en effet une chronologie dans le poème, mais je ne pourrais évidemment pas vous dire le détail de cette chronologie."
225,FAQ10-225,"Le thème commun des éléments de la charade se trouve plutôt dans a/ La philosophie, b/ La spiritualité, c/ L’Histoire, d/ Autre?","La charade a été trouvée par plusieurs joueurs, et il y a un élément qui est facilement identifiable. Donc, là-dessus, je vous laisse le soin de trouver cet élément commun et ça va vous aider, en effet, à trouver le résultat de la charade."
226,FAQ10-226,"Dans l’énigme une, doit-on prendre en compte les lettres en majuscules de chaque ville?","Non, ça n'a pas beaucoup d'importance. Donc non, pas nécessairement."
227,FAQ10-227,"Sur l'échiquier, le pion Plus Ultra est-il une référence historique, géographique, numismatique, autre?","Je dirais que c'est plutôt une référence ou historique ou numismatique. En tout cas, j'exclus la référence géographique."
228,FAQ10-228,"Dans l’énigme cinq, est-ce que “du cachemire, du fer, du jade” aurait pu s'écrire dans un ordre différent?",Il fallait que ce soit dans cet ordre là. 
229,FAQ10-229,"L’autre trésor l’est au regard de la relique, du fil rouge, d’une subtilité du résultat de la charade ou d’autre chose? ",L'autre trésor l'est au regard de quelque chose que vous venez quand même de découvrir.
230,FAQ10-230,"“Regarde les hommes tombés”, les hommes tombent-ils pendant une guerre? Parce qu'ils sont exécutés?","Je parle d'Hommes, il n'y a pas forcément que des hommes. Et en tout cas, ce que je peux vous dire, c'est qu'ils ne tombent pas d'une façon qui est naturelle. C'est un peu contraints et forcés... Pas forcément forcés, mais, en tout cas, ils ne sont pas morts de façon naturelle."
231,FAQ10-231,"Si je devais jouer le rôle du Mal dans un jeu de rôle ayant pour thème l'Élixir d'Or afin de le jouer de la façon la plus fidèle possible je serais plutôt: team Pacman, je vais par les chemins et bouffe tout aveuglément jusqu'à arriver à ma cible. Ou team Sauron, je crée un objet puissant et je les laisse s'entretuer avec, afin de finir le travail sans difficulté.",Je pense que vous seriez plutôt team Sauron.
232,FAQ10-232,Vous nous aviez déjà dit que le personnage des illustrations a vraiment existé et que nous le connaissions probablement. Mais a-t-il aussi inspiré un mythe? Apparaît-il dans des œuvres de fiction?,"Sur le personnage, très honnêtement, je ne pourrais pas en dire davantage. C'est vraiment à vous de comprendre de qui il s'agit. Et donc je réponds très difficilement aux questions à ce sujet."
233,FAQ10-233,"Relier les cendres a-t-il une grande importance dans la chasse ou simplement une portée confirmative du fait, entre autre, que nous portons au bon endroit notre regard?",Ça a son importance. C'est un tracé à effectuer.
234,FAQ10-234,"Au terme du 33e temps, sommes-nous face à face avec l’ordre nouveau, avec une représentation du mal ou avec tout autre chose?","Au 33ᵉ temps, c'est l'heure de vérité. Donc vous êtes face à face avec le mal. Et toute la question est de savoir si vous êtes armé à ce moment là pour combattre le mal ou non."
235,FAQ10-235,Hier aurait-il été un jour plus approprié qu'aujourd'hui pour les relier? Me conseillez-vous d'attendre encore quelques jours?,Non. Vous pouvez les relier dès maintenant.
236,FAQ10-236,"Lors de vos aventures, avez-vous rencontré des clowns? Un peu étrange cette question mais... En d'autres termes, est-ce que vous avez déjà mis les pieds dans un cirque?","Je ne pense pas que ça fasse partie de [la] légende [du Comte de Saint-Germain], non. Donc je vous dirais plutôt que non."
237,FAQ10-237,"1 - Lors de l'aventure, je retrouve un individu qui semble un peu arrogant. Peut-être pourrait-il me dire son fruit préféré, même du bout des lèvres. J'espère que ma tournure de phrase n'est pas trop lourde et que vous comprendrez où je veux en venir. 2 - Je souhaiterais qu'il me dise une chose anodine, comme son fruit préféré, par exemple, ne serait-ce que du bout des lèvres. Ne serait-ce que du bout des lèvres?","Non, je ne pense pas vous suivre là-dessus."
238,FAQ10-238,Vous dites avoir eu mille vies. Est-ce simplement une figure de style ou alors autre?,"C'est une figure de style. Il n'a pas véritablement eu mille vies. C'est la légende du Comte qui l'a fait en effet voyager énormément et connaître tellement d'épisodes de l'histoire, qu'il les narrait tellement bien, que le monde était persuadé qu’il avait eu ces mille vies ou en tout cas qu'il était doté de l'immortalité."
239,FAQ10-239,"Dans votre testament, vous évoquez également certaines de vos aventures, plutôt d'ordre romantique. Est-ce que ça peut être intéressant de pousser un peu, de s'y intéresser davantage? Ou alors vous souhaitez que cela reste dans votre sphère d'intimité?","Le Comte de Saint-Germain a aimé des reines. Vous avez aussi un jeu d'échecs où il y a une reine. Il y a des références implicites, en effet, un côté royal et romantique qui peut être intéressant d'étudier."
240,FAQ10-240,"1 - Certains pensent que la curiosité est un vilain défaut, alors je pense que ça peut être une qualité, voire plutôt une vertu. Être tête en l'air serait-il un défaut pour en découvrir une autre? 2 - En particulier pour découvrir d'autres vertus?","1 - Oui, tout à fait. La curiosité est un très bon défaut pour des chasseurs de trésors. Et être tête en l'air dans l’Élixir d’Or, notamment voir de haut certaines choses, ça peut clairement vous aider. 2 - Non, plutôt pour découvrir des lieux. Ou plutôt pour avoir des intuitions."
241,FAQ10-241,"1 - Je m'en sors plutôt bien côté observations et recherches mais j'ai vraiment de grosses lacunes sur les cryptos pour les déchiffrer, ne serait-ce que même pour les identifier. Est-ce que vous pensez que ce défaut peut être comblé via les bonnes recherches qui finiront par mener du coup sur les bonnes méthodes et qui m’apparaîtront du coup plus clairement? 2 - Donc si je fais les bonnes recherches, en fin de compte, si je travaille bien comme il faut les visuels ou les énigmes, je finirais par comprendre que ce soit sur la méthode ou le cheminement?","1 - Les cryptos à utiliser dans l'Élixir d'Or ce ne seront jamais des cryptos extrêmement complexes ou inconnues du grand public. Donc elles ne viennent pas par hasard. Donc il y aura toujours des éléments dans le jeu qui vous inviteront à utiliser une crypto plutôt qu'une autre. 2 - Oui, exactement."
242,FAQ10-242,"Il est indiqué que ""l'homme y verra net"" et il n'y a pas de majuscules donc s'agit-il d'un individu particulier? Éventuellement qui aurait un lien fort avec la grappe entre autres?","Non, il ne s'agit pas de l'humanité en général. Il s'agit, en effet, d'un seul homme particulier, mais il n'a pas de lien spécifique avec la grappe."
243,FAQ10-243,"Au sujet des cendres, le dicton veut qu'il n'y ait pas de fumée sans feu. Est-ce que cela s'applique également pour les cendres?",Oui.
244,FAQ10-244,Est-ce qu'il m'est possible d'identifier le mal jumeau comme tel sans avoir identifié le mal au préalable?," C'est possible, mais c'est forcément beaucoup plus compliqué. Mais je pense qu’il y a des joueurs qui ont pu trouver le mal après avoir trouvé le mal jumeau, dans le sens inverse. Dans tous les cas, comme ils sont de même nature, mal et mal jumeau, en tout cas dans les énigmes deux et trois, forcément en trouver un vous aide à trouver l'autre."
245,FAQ10-245,Êtes-vous d’accord avec la citation “ce qui apporte la lumière doit supporter la brulure”?,Je suis tout à fait d'accord avec cette citation en effet. Dans le cadre de l'Élixir d'Or notamment.
246,FAQ10-246,"Une fois que nous sommes prêt, pouvons-nous mettre les six énigmes derrière nous tout en ayant gardé les éléments importants découverts dans celles-ci?",C'est même un moment où vous pouvez prendre de la hauteur de vue et être un peu tête en l'air comme le proposait Bobaxx [ndr: FAQ10-240].
247,FAQ10-247,"1 - Mon questionnement est autour du vade retro. Il est évidemment indispensable pour résoudre l’énigme six mais quand nous sommes prêts, devons-nous encore ""vade retro"" sur nos tracés ou dans les énigmes? 2 - À présent, nous pouvons directement avancer sur la zone finale?","1 - Oui. Après vade retro a plusieurs sens. Donc je ne suis pas sûr que vous utilisiez le bon sens ici. 2 - En effet, là, vous commencez à vous rapprocher d'une zone finale."
248,FAQ10-248,Découvrir la carte de la zone finale peut-il nous faire remettre drastiquement en question la zone définie par les tracés de l’énigme six qui nous amène à être prêt?,"La zone finale vous confirme tout ce que vous avez trouvé précédemment. La zone finale est une très grosse confirmation et il n'y aura pas de doute. C’est là-dessus où j'insiste. Une fois que vous avez compris ce que vous aviez en face de vous, qui était l'ennemi, l'adversaire, comment vous devez le combattre, qui est votre allié? En fait, la zone finale, une fois trouvée, vous apparaîtra comme évidente et va recouper tout ce que vous avez trouvé comme cheminement auparavant."
249,FAQ10-249,"La représentation de l’œil qui luit dans le noir pourrait-il, au même titre que l’autre trésor, être considéré comme une relique?","Non pas du tout. Au contraire. C’est très, très loin d'une relique comme je l'ai dit précédemment."
250,FAQ10-250,Lorsque nous sommes sur la zone finale devons nous obligatoirement passer sur une carte papier?,"Non. Vous pouvez tout trouver depuis Google Maps, depuis chez vous. Peut-être zoomer un peu plus. Mais en tout cas, vous pouvez tout faire depuis chez vous. Et sans carte papier."
251,FAQ10-251,"Dans l'énigme 2, est-ce important que l'on soit poli avec nous et qu'on nous salue?","Je pense que ça a son importance. Ça a une importance d'élégance déjà, et ensuite ça vous donne aussi une indication sur les guides en question."
252,FAQ10-252,Regarde-t-on tomber tous les hommes dans un même lieu?,"Vous regardez tous les hommes tombés dans un même milieu dans le mal jumeau. Et à un autre endroit dans le mal, vous regardez, en effet, une fois encore tous les hommes tomber dans ce même second lieu."
253,FAQ10-253,"La chambre cachée nous donne-t-elle un élément capital pour l’issue de notre quête, au delà de la pierre d’attente bien sûr?","Capital non. Pas forcément capital, mais ça va être très utile dans une étape plutôt intermédiaire."
254,FAQ10-254,"Si de tomber honore les hommes, pouvons-nous penser qu’ils sont dans l’équipe adverse du mal jumeau?","Oui, je pense que les hommes qui tombent ne sont pas à associer à un mal, même s'ils sont présents sur le lieu “GPS” du mal et du mal jumeau."
255,FAQ10-255,“Au nord ta croix” de l’énigme six et la croix ayant une fleur sur elle dans INRI sont-elles la même croix?,Non.
256,FAQ10-256,Peut-il être utile de réécrire les huit lieux de l’énigme un dans un autre ordre?,"Je pense que ça peut être utile en effet. En tout cas pas forcement de les réécrire, mais leur agencement déjà n'est pas donné en pure ligne droite."
257,FAQ10-257,"Pour voir par l'autre trésor, ai-je besoin d'une ouverture, d'un trou réel ou métaphorique?","Vous avez besoin d'un point de départ, ensuite vous voyez à travers l'autre trésor pour arriver au mal jumeau. Vous n'avez pas besoin, je crois, d’un trou réel ou métaphorique."
258,FAQ10-258,"Dans l'énigme trois, dois-je trouver une couleur?","Non, vous devez trouver un lieu dans l’énigme trois. Il faut tracer un dernier cercle et il faut trouver le lieu du mal."
259,FAQ10-259,"Une fois le lieu tout de la charade trouvé, y a-t-il encore du travail à faire avant d'avoir la 1ère relique?","Il y a encore un peu de travail à faire, mais le gros est fait."
260,FAQ10-260,Le personnage des visuels est-il forcément un homme?,Je ne répondrai pas à cette question.
261,FAQ10-261,Le cavalier blanc de l’échiquier est-il du même blanc que les autres pièces blanches de l’échiquier?,"Il me semble que c'est un blanc un peu différent. Il assume sa propre particularité de blanc qui, en effet, le différencie du blanc du reste de l'échiquier."
262,FAQ10-262,"Si je vois juste, après être passé sous Golgotha Martyre ma mission n'est pas finie n'est-ce pas? Que fais-je du reste?","Non, la mission n'est pas finie. Je ne peux pas vous dire ce qu’il faut faire du reste."
263,FAQ10-263,Les versions allemande et italienne de l’Élixir sont-elles toujours envisagées?,"La version italienne est finie, elle n’est simplement pas en ligne. Il faudrait que je demande à mes collègues de la mettre ligne dès que possible. Ce sera normalement fait j'espère bientôt. Il faut juste modifier le Joomla. Par contre la version allemande non. Je parle très mal allemand, donc je n'ai pas réussi à trouver quelqu'un de suffisamment compétent pour l'instant en la matière. S'il y a des volontaires qui veulent travailler sous accord de confidentialité partiel pour réaliser la version allemande, vous pouvez évidemment vous manifester, mais vous pourrez plus participer à l’Élixir d’Or après ça."
264,FAQ10-264,"Dans l’indice évoquant “Jerimadeth psalmodiant à Thie”, à la fin du mal de tête, est-il possible de tomber sur une fausse piste?","Je ne pense pas, non. En tout cas, je n ‘ai pas conçu l’indice dans l'optique de vous créer des fausses pistes."
265,FAQ10-265,"Dans l'énigme deux, puis-je me laisser guider par un tracé?","Dans l’énigme deux, il n’y a pas forcément de tracé. Il y a plutôt des points à noter."
266,FAQ10-266,Y a-t-il d’autres lettres rouges à trouver dans le poème?,C'est une très bonne question et je vous répondrais que oui.
267,FAQ10-267,Les hommes qui tombent sont-ils principalement d'une seule nation?,"Ils sont même, je crois, exclusivement d'une même nation."
268,FAQ10-268,"Dans une précédente FAQ, pour la grappe, vous avez précisé qu'il ne fallait pas chercher midi à 14h. Pourrions-nous dire également que “cela coule de source”?","Non, je ne pense pas. Il n'y a pas de rapport particulier à l'eau. Donc je dirais plutôt que non. Il n'y a pas de lien avec une source qui jaillirait non plus. Donc non."
269,FAQ10-269,La charade me donne un lieu relativement important comportant plusieurs reliques. Mon “tout” me donne-t-il avec certitude la bonne relique?,"Mon tout ne vous donne pas une relique. Mon “tout” va vous aider évidemment à trouver une relique, mais il vous donne, comme je l'ai dit, un lieu un peu plus vaste qu'il faut resserrer afin de pouvoir trouver votre relique."
270,FAQ10-270,Les terminaisons et les ramifications des racinés de l'arbre de l’illustration un [...],"Oui, en effet, c'est une libre interprétation de l'artiste."
271,FAQ10-271,Peut-on oublier la voute céleste dans le jeu?,"Non. En tout cas, je ne pourrais pas vous dire si il faut l'éliminer."
272,FAQ10-272,Penses-tu que la plupart des chercheurs n'ont trouvé aucun lieu après le changement d'échelle?,Je pense que ça intervient à un tel stade du jeu avancé que en effet. Sinon l'Élixir aurait peut-être déjà été découvert ou en tout cas la zone finale serait déjà pas mal labourée. Ce n'est pas encore le cas.
273,FAQ10-273,L'illustration six est-elle compréhensible avant la résolution de la majorité des énigmes?,Je répondrais plutôt que non.
274,FAQ10-274,"L'aventure de notre barbu aurait-elle été possible s’il n'avait jamais eu de bâton? Attention, pas de triche, il n'a pas le droit d'en prendre un autre ou de se faire aider","Oui, l'aventure de notre barbu, le bâton, je crois que j'ai déjà répondu là-dessus. [ndr: le bâton] C’est une indication qui dit que c'est en quelque sorte un pèlerin. Quelqu'un qui cherche et qui essaye d'avancer vers une vérité. Donc c'est plus métaphorique, mais ça n'a pas de sens extrêmement précis et concret dans le jeu."
275,FAQ10-275,"Un gobelet syncrétique, cela vous parle ?","Non, ça me parle pas un gobelet syncrétique."
276,FAQ10-276,"“Rejoins le!” Cela nécessite donc un déplacement, devons-nous du coup effectuer un tracé ?","Sans doute, très fortement."
277,FAQ10-277,L'inversion des cases de l'échiquier a-t-elle un intérêt?,"Là-dessus, je vous laisse interpréter cette inversion comme vous le souhaitez."
278,FAQ10-278,"1 - Dans INRI, est-ce que revenir sur nos pas nécessite uniquement un déplacement spatial ou également temporel? 2 - Enfin, surtout sur INRI en fait.","Dans INRI il n'y a pas de déplacement temporel. Sauf si vous considérez que l'ordre de résolution des énigmes peut être vu comme un déplacement temporel. Mais en tout cas, il n'y a pas vraiment de notion temporelle, c'est plutôt une notion spatiale qui est recherchée. 2 - Spatial."
279,FAQ10-279,"1 - En dehors de la chasse, est-ce que “tracer ce que Dieu veut” serait différent selon notre confession religieuse? 2 - Parce que “ce que Dieu veut” est assez identique malgré les différentes confessions religieuses?","1 - Je dirais que pour la plupart des confessions religieuses, plutôt non. 2 - Oui, parce que, si vous voulez, la notion de trinité, elle est assez présente dans le judaïsme ou dans les principaux monothéismes. Il y a peut-être un ou deux éléments différenciant, en effet, qui peuvent être importants dans les choix philosophiques ou religieux que vous faites dans la chasse de l’Élixir."
