,,Question,Réponse
292,FAQ12-292,"La modification induite par 253548 sur objet de la chambre cachée est-elle d'ordre physique, spirituelle ou mathématique ?","Là-dessus, je pourrais pas vous apporter de précisions malheureusement."
293,FAQ12-293,L'Aigle immortel a-t-il volé à travers toute l'Europe ?,"Là-dessus, je pourrais pas vous répondre."
294,FAQ12-294,"Nos trois grappes d'or sont-elles calmes ou plutôt tumultueuses, voire pétillantes ?",Je ne leur prêterais pas d'intention particulière.
295,FAQ12-295,"L’illustration six est à mon sens la plus difficile à travailler. Contrairement aux autres, elle ne laisse que très peu de débuts de pistes possibles pour nos recherches. Doit-on la mettre de côté jusqu'au moment où nous avons suffisamment d'éléments résolus, découverts ? Ou devons-nous être davantage attentifs dans l'observation dès le début ?",Je vous conseillerais d'être attentifs dès le début du jeu.
296,FAQ12-296,Trouve-t-on des indices sur la pièce dans les cinq premiers visuels ?,"Là-dessus, je ne peux pas vous répondre."
297,FAQ12-297,L’aigle du visuel trois peut-il faire référence à un personnage féminin ?,"Je peux pas vous répondre. L'aigle fait bien référence à quelque chose, mais c'est à vous de découvrir à quoi il fait référence."
298,FAQ12-298,"Si les vues satellitaires de Google Maps changeaient du jour au lendemain avec par exemple une végétation plus touffue ou de la neige sur le pile-poil, est-ce que cela rendrait sa localisation plus difficile depuis notre canapé ?",Je ne pense pas que ça rendrait la localisation plus difficile en sachant que la confirmation du pile-poil se trouve en allant creuser.
299,FAQ12-299,"Lors d'une FAQ, je vous ai demandé si la chasse était en mode “fractale” et vous avez répondu que non. Pour autant, ce procédé est présent dans l’indice un, lettres rouges. Pouvez-vous nous dire si son utilité est bien réelle et présente dans une partie du jeu ? Et si oui, est-ce plutôt au début, au milieu ou à la fin ? Voire un peu dans tout ?","Vous pouvez travailler les éléments rouges dès le début, mais en l'occurrence leur utilité est très importante et par conséquent est plutôt à situer en fin de jeu."
300,FAQ12-300,"Après avoir accompli notre ultime voyage, lorsque nous sommes au milieu, est-ce à cet endroit que nous devons suivre le blaireau ?",Je vous déconseille d'accorder une importance aussi majeure à ce pauvre blaireau. Je serais tenté de répondre que non.
301,FAQ12-301,La découverte de la chambre cachée est-elle essentiellement due à notre sens de l'observation ?,Je ne dirais pas ça. Non. C'est pas lié à un sens de l'observation.
302,FAQ12-302,"Vous avez dit que l'épée ne servait qu'une seule fois, mais le personnage a-t-il eu l'intention de s'en servir sans y parvenir ?","C'est une bonne question. Et la réponse est non. Il n'a pas eu l'intention de s'en servir sans y parvenir. Au contraire, il considère qu'il n'est pas suffisamment digne pour s'en servir et fait l'effort pour parvenir à ce niveau de dignité, avant de s'en servir au moment fatidique."
303,FAQ12-303,Les lettres rouges sont-elles le fil rouge ?,"Alors c'est une bonne question puisqu'il y a le terme rouge dans les deux, mais je pourrais pas y répondre."
304,FAQ12-304,"Ayant pris un peu de hauteur, j'ai cru reconnaître l'illustration six en survolant une zone. Devrais je changer de lunettes ?",La réponse est non. Pas du tout.
305,FAQ12-305,"Est-ce que sur l’illustration deux, le plomb et la plume ont une importance ?","La plume, en effet, faisait partie du cahier des charges. Le plomb, je ne vois pas [de plomb] sur l'illustration deux."
306,FAQ12-306,Le jugement dernier est-il à associer à une couleur ?,"Je ne peux pas vous dire si le Jugement Dernier intervient, ni même s'il est associé à une couleur. J'aurais plutôt tendance à dire que le jugement dernier n'est pas forcément associé à une couleur."
307,FAQ12-307,Devons-nous considérer 1784 comme référence pour choisir une bonne valeur de conversion ?,"Ça dépend. Si la pièce était encore en activité, oui. Parce que c’est la date où le Comte rédige les énigmes et le testament. Si la pièce, au contraire, n'était plus en activité, j'aurais tendance à répondre que non."
308,FAQ12-308,Le trou sur le visuel trois se situe-t-il également au pied du pic dans le monde réel ?,Non.
309,FAQ12-309,"Pouvez-vous répondre à des questions sur l’objet de confirmation laissé sur place ? Ou bien, cela est encore trop tôt ?","Ça me paraît un peu tôt, et ça me paraît quand même donner un gros indice pour le pile poil. Donc non, pas pour l'instant."
310,FAQ12-310,Peut-on dire que c'est la guerre sur le visuel deux ?,"Non, ce n'est pas la guerre. Ce n'est même pas une bataille."
311,FAQ12-311,Bernard Werber fait-il partie de vos sources d'inspiration ?,Non.
312,FAQ12-312,"Illustration deux, la plume et la pomme sont-ils importants ?",Je ne vois pas de pomme.
313,FAQ12-313,"Le cheminement visuel trois, quatre et cinq est-il un cheminement de l'énigme cinq ?","Non, je ne pense pas. Je ne crois pas."
314,FAQ12-314,Le temple de l’illustration cinq est-il plutôt un lieu de culte ou de cérémonie ?,"Je pourrais pas vous dire s'il s'agit d'un temple. Je pourrais uniquement dire qu'il s'agit d'un bâtiment. Et que ce bâtiment, vous pouvez évidemment le reconnaître."
315,FAQ12-315,"Newton, né à Boston ?","Alors, la pomme, d'accord. La pomme, la gravité. Non. D'ailleurs, il me semble que Newton n’est pas né à Boston. Il semble qu'il est né, si je me trompe pas, dans un petit village en Angleterre."
316,FAQ12-316,Peut-on court circuiter la pièce ? [ndr: un raccourci dans le cheminement],Ça me paraît compliqué parce que la pièce est un des éléments les plus durs à trouver et il faut avoir quand même bien avancé dans le jeu pour pouvoir la trouver.
317,FAQ12-317,"Laquelle option vous semble envisageable ? Couper quelques branches de l'arbre (visuel un), tailler la vigne (visuel un), ou arracher la mousse (visuel cinq) ?","Malheureusement, aucun des trois."
318,FAQ12-318,"Je n'y connais rien en numismatique, Pouvez-vous me confirmer que sou est le pluriel de sol ? Un sol, quatre sous ?",J'avoue que je ne sais pas. Aucune idée.
319,FAQ12-319,Le symbole sur le cavalier noir a-t-il une importance ?,"Oui, tout à fait."
320,FAQ12-320,Est-ce que les lieux éventuels que l'on pourrait trouver sont des lieux dans lesquels le Comte de Saint-Germain a vécu ?,"Pas forcément tous. Non, non. Il y a une part évidemment de fiction dans l'Élixir. Donc tous les lieux cités ne sont pas forcément des lieux où une présence du Comte a été documentée. Et par ailleurs, beaucoup de lieux trouvés dans l'Élixir n'ont pas forcément de lien avec le personnage réel du Comte de Saint-Germain."
321,FAQ12-321,Peut-on court circuiter la pièce ? [ndr: électriquement],"Oui. Pour moi, on peut court circuiter la pièce. Tout à fait."
322,FAQ12-322,Y a-t-il un ou plusieurs morts lors du combat du visuel six ?,Non. Il n'y a pas plusieurs morts. Il n'y a qu'un seul mort.
323,FAQ12-323,Le lieu familier et la chambre cachée sont-ils trouvables de façon indépendante l'un de l'autre ?,Oui.
324,FAQ12-324,L'aile du cheval est-elle percée par l'épée ?,[Elle n’est pas] percée par l'épée.
325,FAQ12-325,Y a-t-il deux joueurs présents lors de la partie d'échecs ou d'autres ?,"Là-dessus, je pourrais pas vous répondre. Ce que vous voyez sur le visuel doit vous donner une indication suffisante."
326,FAQ12-326,Le testament du début est-il un écrit tumulaire ?,"Non, il n'a pas été écrit depuis une tombe. Il a été écrit du vivant du Comte de Saint-Germain."
327,FAQ12-327,"Dans une FAQ, je vous avais demandé si le soleil avait rendez-vous avec la lune, et vous n'aviez répondu qu'en parlant du soleil. Quid de la lune ?",Je peux vous confirmer que le soleil n'a pas un rendez-vous particulier avec la lune.
328,FAQ12-328,"L’indice ou la confirmation laissé sur le lieu de la cache, Est-ce un élément naturel originel ou un élément fabriqué par vos soins ?","Je ne peux pas répondre à cette question, donc je vais passer."
329,FAQ12-329,L'écrit tumulaire s'applique-t-il uniquement au 12ᵉ rayon d'orbe crépusculaire ?,"Oui, tout à fait. Est-ce qu’il s'applique strictement uniquement à ça ? Peut-être pas. Mais pour le coup, ce qui va vraiment vous aider dans le jeu, c'est ça."
330,FAQ12-330,"Bostogne, dans l'indice un, existe-t-il ?",Je ne me souviens pas d'avoir mentionné Bostogne dans l'indice un. Je dirais que non.
331,FAQ12-331,"Le tracé sur la porte du bâtiment de l'illustration cinq est-il plutôt un mode d'emploi ? Ou plutôt autre chose ? Un crypto, etc.","C'est un indice qui vous permet de vous renseigner sur autre chose. Et par ailleurs, il y a des éléments évidemment qui vous permettent de deviner de quel bâtiment il peut s'agir."
332,FAQ12-332,"Pourrait-on avoir une approche bestiaire, réelle ou imaginaire, du mal et de son jumeau, qui s'ajouterait à leur double nature commune déjà existante ?",C'est une très bonne question et la réponse est oui.
333,FAQ12-333,"En début de FAQ vous nous avez dit que de nombreux chasseurs ont résolu les énigmes un, deux, trois, quatre. Nombreux c'est combien ? Dix, cent, mille ?","Je n’ai pas reçu mille cheminements, forcément, ce sera moins. C'est plus que dix. Je dirais que c’est plusieurs dizaines."
334,FAQ12-334,Y a-t-il des joueurs qui ont trouvé la bonne pièce pour le moment ?,"Non, Je n'ai pas vu passer la bonne pièce. C’est l'un des éléments extrêmement bloquant à ce stade du jeu."
335,FAQ12-335,Pouvons-nous tuer et être digne ?,Oui.
336,FAQ12-336,"Un même individu pouvant incarner de nombreux personnages aux cours des siècles, je me demandais si la personne des visuels est à la fois un même individu et un même personnage ?","Non, il ne peut pas s'agir de plusieurs personnages en un."
337,FAQ12-337,Le lieu où se trouve mon mal me fait penser au début de l'énigme cinq normal ou je délire ?,"Le lieu où se trouve le mal, a priori, que ce soit pour le mal ou pour le mal jumeau, non, ça ne me parait pas normal."
338,FAQ12-338,Bostogne pourrait-il être une localité existante dans l'énigme une ?,"Oui, tout à fait. Encore faut-il savoir à quoi ça peut faire référence."
339,FAQ12-339,Bostogne ? Première énigme ? Bastogne ? Ou Boston ?,"C'est une très bonne question, mais je pense que vous avez déjà toutes les clés en main pour savoir. Et je crois qu'il y a eu peut-être un coup de pouce à ce sujet."
340,FAQ12-340,Est-ce que vous nous conseillez de ne pas trop garder la tête dans les étoiles ? Une fois ça va mais trop longtemps ça risque de faire mal au cou.,"Je suis tout à fait d'accord avec vous. Une fois ça va, faut pas y rester trop longtemps."
341,FAQ12-341,Y a-t-il un soutien psychologique prévu pour les joueurs qui voient toutes leurs théories voler en éclats ?,J'essaie justement de pas trop casser les théories. Mais je préfère que des théories volent en éclats plutôt qu'elles soient le fruit de de mauvaises interprétations et que finalement elles bloquent tout le jeu.
342,FAQ12-342,Est-ce que ceux qui ont le mal peuvent penser le contraire ? Ou est-ce que c'est plutôt un bien pour eux ?,"Non, ça me paraîtrait quand même assez compliqué aujourd'hui de considérer que le mal peut être un bien. Après, c'est un point de vue subjectif. Peut-être que d'autres n'auraient pas les mêmes visions des choses. Mais ça me paraît en tout cas compliqué."
343,FAQ12-343,"Réincarnation, résurrection ou transmigration ? Laquelle de ses actions choisir ?",Je dirais : aucun des trois. Vous n'avez pas besoin de vous incarner. Vous n'avez pas besoin de ressusciter. Et transmigration non plus.
344,FAQ12-344,Y a-t-il trois cercles ou quatre cercles ou plus ?,Je ne peux pas vous donner le nombre de cercles.
345,FAQ12-345,Le dernier cercle est-il le seul à tracer pendant toute notre quête ?,Ça je pourrais pas vous dire si il y a d'autres cercles. Mais tous les tracés sont précisés dans le jeu. Notamment de quelle nature peuvent être les tracés.
346,FAQ12-346,Le mal s'attaque aux gens trop parfaits ?,"Bien sûr. En priorité, oui, tout à fait."
347,FAQ12-347,"Lors du combat final, nous conseilleriez-vous de nous mettre à l'abri ou au contraire de faire face ?","Je vous conseille de faire face. Parce que normalement, à ce moment là, vous êtes prêt."
348,FAQ12-348,Un cercle peut-il enjamber plusieurs continents ?,"Oui, bien sûr. Il n'y a pas de limite à la distance."
349,FAQ12-349,Le mal atteint-il le lieu familier ?,Je ne pourrais pas répondre à cette question.
350,FAQ12-350,Les hommes qui tombent au mal jumeau sont-ils nombreux ?,Non.
351,FAQ12-351,Tombent-ils uniquement sur le lieu du mal jumeau ou partout en France ?,Ils tombent uniquement sur le lieu du mal jumeau.
352,FAQ12-352,Les cercles se croisent-ils ?,Je ne pourrais pas répondre à cette question.
353,FAQ12-353,Une ville frontière est-elle présente vers la fin de l'énigme cinq ?,Je pourrais pas vous répondre ça donnerait un peu trop d'indices.
354,FAQ12-354,Est-ce que le moment du face à face est également un moment précis de réflexion ?,"Oui, tout à fait. Parce que c'est le moment où vous choisissez avec qui vous allez vous battre."
355,FAQ12-355,"Quitte à boire de l'eau rien que de l'eau, serait-ce : de l'eau de pluie, de l'eau minérale ou de l'eau du robinet ?",Ce serait de l'eau de pluie.
356,FAQ12-356,Donc le mal n'est pas une question de croyances ? Il est universel ? ,"Ça c'est une grande question. Est-ce que l'homme a une conscience innée de la notion du bien et du mal ? Quelle que soit la culture, quel que soit le lieu ? Les religions se posent toujours cette question. Oui, pour moi il y a une part de croyances. Je crois qu'une grande majorité des gens penserait comme moi qu'il s'agit d'un mal. Après, je ne peux pas parler au nom de tout le monde, donc forcément que certains penseraient peut-être, des esprits déviants sûrement, penseraient qu'il s'agit d'un bien ou d'un mal pour un bien."
357,FAQ12-357,Toutes les énigmes se rapportent au domaine viticole ou c'est pure coïncidence ?,"A priori, si vous tombez sur des domaines viticoles ou sur des endroits qui font penser au vin, ce n'est pas un hasard sur une chasse sur le vin."
358,FAQ12-358,"Le personnage sort du cheval, vient-il d'une grotte ?",Je pourrais pas vous répondre.
359,FAQ12-359,La fidèle monture n'est elle fidèle qu'à moi ?,"C'est une très bonne question. À priori, la réponse est oui."
360,FAQ12-360,"J’ai lu que le Comte de Saint-Germain était de confession juive, mais je vois beaucoup de références bibliques. Faut-il plus s'orienter vers le christianisme ou le judaïsme ?","Le Comte de Saint-Germain a eu plein de croyances plus ou moins avérées. Ce dont on est sûr, c'est qu'il a prêché le vrai, le faux, en fonction des personnes avec lesquelles il s'adressait. Donc je ne pense pas qu'il y a de certitudes sur sa croyance. Là pour le coup, c'est à vous d'identifier, mais je pense que c'est assez clair dans le parchemin, les références religieuses qu'il peut y avoir s'il y en a."
361,FAQ12-361,"Le mal, s'il croisait d'autres mals de fiction, que ferait-il ? S'allier, s'entre tuer comme des animaux ?",Le mal me semble assez unique là-dessus et orgueilleux pour penser triompher tout seul.
362,FAQ12-362,Un acte iconoclaste a-t-il sa place ?,"Plutôt qu'un acte iconoclaste, je dirais que c'est vraiment une intuition forte, une conviction forte qui est née de votre fil rouge que vous avez abondé par votre fil rouge qui vous aidera à un moment crucial. Je vois pas sinon d'acte iconoclaste."
363,FAQ12-363,L'histoire que nous raconte le poème est-il en lien avec le mal et le mal jumeau ?,"Le poème, évidemment, n'est pas indépendant des énigmes écrites et visuelles. Donc il est tout à fait possible que le poème fasse des références à des éléments que vous avez déjà découverts et qu’il y ait des sensations de déjà-vu."
364,FAQ12-364,Le quadrillage tel qu'il est dessiné sur l’illustration quatre suffit-il ou doit-on le prolonger ?,Non. Le quadrillage se suffit à lui même.
365,FAQ12-365,Un petit verre de rosé peut-il être d'une certaine aide avant d'affronter le mal ?,"C'est une très très bonne question, et pour le coup, je ne pourrais pas y répondre."
366,FAQ12-366,La seconde mort vous parle ?,"Oui, tout à fait. Et je m'abstiendrais de tout commentaire à ce sujet."
367,FAQ12-367,Remercie-t-on notre personnage dans beaucoup d’endroits ?,"Non, je ne pense pas."
368,FAQ12-368,L’histoire de la trahison de Jésus par Judas peut-elle avoir son importance ?,Je pourrais pas vous répondre.
369,FAQ12-369,Ce qui doit tous nous mettre sur un même pied d'égalité est-il lié au poème ?,Pas nécessairement.
370,FAQ12-370,De l'eau pour le mal jumeau ?,Non.
371,FAQ12-371,"Peut-on trouver dans le parchemin des éléments de piste ou confirmation pour les différentes variables liées au calcul nous menant au lieu familier ? Prince, évêque et lieue notamment ?","Pour moi, un indice qui est suffisamment fort peut faire effet de confirmation à partir du moment où il n'y a pas 15 000 options à explorer. Sans qu'il y ait besoin de deux ou trois éléments supplémentaires."
372,FAQ12-372,Le lieu du mal jumeau est-il en rapport avec la strophe quatre du poème ?,"Là-dessus, je ne peux pas vous répondre. Mais évidemment que le poème nourrit une grande partie des énigmes."
373,FAQ12-373,Faut-il pencher l’illustration cinq sur la droite pour mieux la comprendre ?,"Non, je ne vois pas d'élément particulier."
374,FAQ12-374,L'étymologie des lieux découverts a-t-elle son intérêt ?,"Oui, tout à fait. De façon générale, je pense notamment peut-être à l'énigme un, les lieux n’ont pas été choisis au hasard. Evidemment, faire des recherches sur les lieux sur lesquels vous tombez pourra vous être très utile."
375,FAQ12-375,"L’or qui pleut sur la terre, bien qu'étant un évènement météorologique exceptionnel, s'est-il déjà produit jadis ?","De façon réelle, je ne crois pas. Ça m'étonnerait beaucoup. Peut-être dans la légende de Midas ou de Crésus, mais à part ça. Peut-être la rivière Pactole, On pourrait dire qu'il y avait des cascades donc l'or tombait du haut de la cascade. Mais à part ça, non, je ne pense pas."
376,FAQ12-376,Purgatoire pour finir ?,"Là-dessus, je pourrais pas répondre."
377,FAQ12-377,L'élément de confirmation est-il plus facile à voir de jour ?,"Je préfère pas répondre à cette question. De façon générale, Je ne vais pas répondre à des questions sur l'élément de confirmation du pile-poil."
378,FAQ12-378,Est-ce que notre mal tombe à l'eau ?,"C'est une très bonne question et je pense que oui, en quelque sorte."
379,FAQ12-379,Est-ce qu’il s'est déjà produit jadis de façon non réelle ?,"Non, je ne crois pas."
380,FAQ12-380,Un sport à balle a-t-il sa place dans le jeu ?,Je pense que non.
381,FAQ12-381,La rédaction d'un traité peut-elle être en lien avec l'énigme une ?,"Alors à chaud comme ça, il faudrait que je vérifie. [Il y a] dans le jeu, en tout cas, des références à des traités. Donc il faudrait que je vérifie à quel endroit exactement."
382,FAQ12-382,Nous rendre digne nous permet-il d'y voir net ?,"Si c'est une référence au poème, je dirais que ça n'a pas forcément de lien direct."
383,FAQ12-383,"S'il n'y a pas de cendres sans feu, comment peut-il y avoir des cendres dans l'eau ?","Quand je répondais à la question “Est-ce que notre mal tombe à l'eau ?” C'était plutôt de dire que le mal peut tomber, peut chuter face à de l'eau, en tout cas peut s'éteindre face à l'eau. L'eau peut être un adversaire du mal. C'est dans ce sens là que je répondais à la question. J'espère que c'est un peu plus clair."
384,FAQ12-384,"Que dirait le mal s'il pouvait parler des blasphèmes, des sujets philosophiques, des insultes ?",Je pense qu'il pourrait proférer des malédictions ou en effet des insultes. Je ne pense pas qu'il pourrait blasphémer.
385,FAQ12-385,On nous demande de voir l'œil des ténèbres. Un élément de l'oreille peut-il aussi être intéressant à observer d'un point de vue architectural ?,"Non, je ne crois pas non."
386,FAQ12-386,La métempsychose était-elle familière au Comte de Saint-Germain ?,"En tout cas, ça n'a pas d'utilité particulière, je pense, dans la chasse."
387,FAQ12-387,"Le cheval de l’énigme cinq est-il une référence historique, géographique, autre ?","Là-dessus, je pourrais pas vous répondre précisément, mais évidemment, c'est une référence assez connue d'ailleurs."
388,FAQ12-388,"À choisir : Eau de javel, Eau de Cologne ou Eau bénite ?",Je dirais plutôt eau bénite à choisir.
389,FAQ12-389,Marie l'Égyptienne est-elle familière ?,Je peux pas répondre à cette question.
390,FAQ12-390,Peut-il y avoir une notion de féminité pour le lieu familier ?,"Oui, c'est possible, je pourrais pas vous répondre par oui ou par non là-dessus."
391,FAQ12-391,La pierre d'attente est-elle un type de pierre qu'on ne trouve spécifiquement que sur une partie du globe ?,"Oui, tout à fait. La pierre d'attente n'est pas présente tous les pays, dans tous les cultures."
392,FAQ12-392,Confirmez-vous que dans l'indice c'est bien déluge de feu ?,"C'est une très bonne question. Et là-dessus, je vous invite à relire l'indice avec attention. Je pourrais pas vous vous donner plus d'éléments à ce sujet. Ce qui est certain, c'est que dans l'indice, il est noté “mon doigt toisant le mors et l'autre le déluge” “de feu Jérimadeth, la psalmodiant à Thie”"
393,FAQ12-393,Le quadrillage a-t-il un lien avec le lierre ?,Non.
394,FAQ12-394,"Un trésor, cela ne se trouve pas sous les sabots d'un cheval ?","Dans le cadre de la chasse, en l'occurrence, une fidèle monture vous accompagne. Vous accompagne même au lieu final."
395,FAQ12-395,L'Entente Cordiale a-t-elle sa place dans l'aventure ?,"Non. L’Entente Cordiale c’est 1905 ou six, je crois. Très anachronique. À l'époque ou le Comte rédigeait son testament, c'était plutôt la mésentente cordiale."
396,FAQ12-396,Le lieu de la première relique peut-il nous aider pour la pièce ?,"Là-dessus, je pourrais pas vous répondre."
397,FAQ12-397,Le Tonnerre de feu fait-il à référence à un incendie ?,Pas exactement.
398,FAQ12-398,Est-ce que l’allié précieux se “oint” à moi pour combattre ?,"Non, pas exactement. Il se joint vraiment à vous. Il n’y a pas vraiment de notion de bénissement."
399,FAQ12-399,"La forme des nuages sur l’illustration six, fait-elle partie du cahier des charges ?",Non.
400,FAQ12-400,"Si l’entente cordiale est anachronique, doit-on donc en conclure qu’aucun évènement de cette période n'a sa place ?","Je répondrais pas sur le rapport au temps du Comte, mais en l'occurrence, je peux vous confirmer que le début du XXᵉ siècle n’a pas de rapport avec la chasse et notamment s'agissant de l'Entente Cordiale. Au contraire, la chasse s'inscrit plutôt dans un contexte très féroce de compétitions et de guerres entre la France et le Royaume-Uni."
401,FAQ12-401,Est-ce que le fait que le cheval soit ailé est important ? Est-ce Pégase ?,Je pourrais pas répondre à cette question.
402,FAQ12-402,Allié précieux et Alliance nouvelle sont-ils liés ?,"C'est une très bonne question. Malheureusement, je ne pourrais pas y répondre."
403,FAQ12-403,Doit-on s'inquiéter du fait que le bleu soit si peu présent ?,"Non, pas besoin de s'inquiéter."
404,FAQ12-404,Appréciez-vous les joutes et tournois ?,"Moi à titre personnel, oui, j'adore ça. S'agissant du Comte de Saint-Germain, je suppose que oui. Tout à fait."
405,FAQ12-405,Confirmez-vous qu'il n'y a pas de frontière entre le mal et son jumeau ?,"Non, il n'y a pas de frontière entre le mal et son jumeau."
406,FAQ12-406,Doit-on se préoccuper de ce que fait le personnage une fois le mal combattu ?,"Une fois le mal combattu, tout va bien et c'est la fin du jeu. C'est le moment où vous trouvez le trésor."
407,FAQ12-407,L'œil de ténèbres est-il plus à considérer comme une porte de sortie ?,"Ça m'amène à une très bonne remarque. On m'a posé une question de “est-ce qu'il fallait fuir à un moment dans la chasse ? J'ai peut-être répondu un peu trop vite qu'il ne fallait pas fuir, mais faire face. Mais en l'occurrence, juste avant de faire face, l'œil de ténèbres vous effraye et vous amène à chercher un allié précieux, donc à temporairement vous éloigner de cet œil."
408,FAQ12-408,Peut-on dire que l'objet de la chambre cachée n’est pas un objet que l'on peut transporter ?,J’aurais du mal à répondre à cette question.
409,FAQ12-409,"“Porte ton regard au loin”, comment peut-on comprendre cette notion de distance ?","Il y a “étends tes bras et porte ton regard au loin” et de façon générale dans l'énigme, tout vous est précisé à la fois la mesure et ce qu'il faut regarder."
410,FAQ12-410,Êtes-vous d'accord pour dire que le mal est gigantesque sur un visuel ?,"Je dirais que le mal est bien représenté sur les illustrations de l'Élixir, en effet."
