,,Question,Réponse
115,FAQ12-115,"Concernant la pièce à trouver, est-il possible de la trouver uniquement par les énigmes ?","De toute façon, il n’y a que les énigmes, donc oui. En sachant évidemment que les énigmes comme sur d'autres éléments du jeu, pas forcément sur la pièce d'ailleurs, mais vous invitent à faire des recherches documentaires, donc à sortir du parchemin. Donc oui, tout à fait."
116,FAQ12-116,"Vous nous parlez de ""zone"". Pouvez-vous nous préciser ce que vous entendez par ""zone"" ? D'une façon générale, est-ce une surface de la taille d'une grande ville ? Ou plutôt d'une commune, d'un département ?","Pour moi, c'est assez restreint, ça ne va pas dépasser la taille d'une commune. Ça serait même plus petit que ça. Parce que c'est vraiment le lieu où vous devez progressivement arriver vers un pile-poil quand même déjà assez resserré."
117,FAQ12-117,"Pour que l'oeil des ténèbres luisent dans le noir, de manière non imagée, est-ce une bonne idée d'allumer ses chandelles ? Et si je recherche de quelle manière est constituée cet œil, celui qui a découvert cette matière, arriverais-je à trouver un lien avec l'alchimie qui serait une sorte de confirmation ?","Non, vous n'avez pas besoin d'une action particulière à mener à ce moment là. Et la deuxième partie, je préfère ne pas répondre."
118,FAQ12-118,"Peut-on dire que dans le déroulé du jeu, une couleur nous manque et que c'est à nous de la trouver ?",Je vous laisse répondre à cette question.
119,FAQ12-119,"Concernant le fil rouge, vous avez souvent utilisé l'expression “selon le fil rouge que vous avez choisi”, c'est-à-dire qu'il peut y avoir plusieurs fils rouges ?","Il peut y avoir plusieurs fils rouges, évidemment. Le Comte a tendu pas mal de pièges qui peuvent se suivre sur plusieurs énigmes, jusqu'à un stade assez avancé à la manière d'une métaphore filée. Ce que je pourrais vous dire c'est par contre, il n’y a qu'un seul bon fil rouge, évidemment, pour avancer dans le jeu.
"
120,FAQ12-120,[...] Peut-il y avoir plusieurs chemins pour arriver au coffre selon le fil rouge choisi ?,"La réponse est non. Et en effet, comme vous dites, plutôt un seul chemin que vous allez comprendre si vous avez le bon fil rouge. Et vous pourriez comprendre d’autres choses avec un autre fil rouge, mais ça ne serait pas le bon choix."
121,FAQ12-121,Les éléments rouges du testament doivent-ils constituer notre fil rouge ?,Je ne peux pas répondre à cette question.
122,FAQ12-122,Peut-on dire que 3c64 est incomplet ?,Cela vous donne une information exhaustive sur le cheval à choisir. C’est tout ce que je peux vous dire. En sachant évidemment que le cheval choisi n'est pas une finalité forcément en elle-même. Donc toujours un peu incomplet on va dire au regard de l'énigme dans son ensemble.
123,FAQ12-123,Peut-on dire que le dernier cercle englobe tous les premiers cercles ?,"C'est une très bonne question. Je pense que vous avez la réponse, mais je préfère ne pas répondre à cette question."
124,FAQ12-124,"Même si le Comte a un rapport au temps particulier, peut-on considérer qu'au moment où il a rédigé le parchemin, il n'avait accès qu’aux outils matériels (je ne parle pas des connaissances) de son temps ?","Hormis Google Maps, on va dire, oui le Comte a, en effet, accès aux techniques de son temps et donc il n’y aura pas a priori d’anachronismes là-dessus."
125,FAQ12-125,"Depuis la dernière FAQ, je pense que vous avez eu le temps d'écouter une partie du répertoire de France Gall et de Jacques Brel. Je retente donc ma chance: certaines de leurs chansons peuvent-elles faire écho avec l’Élixir d'Or ? Je pense à une pour chaque.","Tout à fait. Je connaissais un peu en partie. Je suis fan de chanson française, mais pas dans le détail on va dire. Je suis en effet allé me documenter aujourd'hui sur le répertoire intégral des deux artistes. Pour France Gall, je n'en ai pas trouvé. Je ne connais pas les paroles de toutes les chansons, donc je me suis contenté des paroles des chansons que je connaissais et des titres des autres chansons. S'agissant de Jacques Brel, par contre, on parle bien de faire écho, donc pas forcément de donner un détail. Je n'ai pas utilisé Jacques Brel pour créer les énigmes, mais “ça va”, “le Chevalier au miroir” et “les prénoms de Paris”, “Les prénoms de Paris” qui est d'ailleurs une très belle chanson, si vous le connaissez pas, je vous conseille de la réécouter, oui peuvent faire écho à l'Elixir d’Or."
126,FAQ12-126,Faut-il garder la trinité à portée de vue lorsqu'on plante la pelle ?,Je ne peux pas répondre à cette question.
127,FAQ12-127,"Dans le cadre de la chasse, selon vous, lors d'une dégustation de vin, le plus important, c'est : Petit a, de le sentir ? Petit b, de savoir le déguster ? Petit c, de savoir le servir ? Petit d, d'en faire profiter les autres ? Petit e, de savoir le confectionner ? Petit f, de connaître sa composition ? Ou petit g, peu importe, dans le cadre de la chasse ça n'a pas grand intérêt ?","Pour la chasse, je dirais que le plus important, c'est petit a et petit f. Donc le sentir, et connaître sa composition. Et puis, pour après la chasse, quand on a trouvé le trésor, évidemment d'en faire profiter les autres. Donc réponse d."
128,FAQ12-128,Vous avez dit dans l'illustration cinq le personnage déposait l’épée car il n'en était pas digne. Est-ce donc un passage obligé dans la chasse ? Aurait-on pu éviter tout cela en nous montrant digne plus tôt ?,"Non, vous devez passer par là. En effet, on peut considérer que c'est un passage obligé."
129,FAQ12-129,Peut-on avoir découvert notre allié précieux avant d'avoir été digne ?,"Si vous le découvrez, encore mieux si vous faites appel à lui, c'est à priori que vous en êtes digne, sinon vous n'auriez pas l'idée."
130,FAQ12-130,La relique proche du mal jumeau est-elle de même nature que notre première relique ?,"En effet, les autres reliques à trouver, s’il y en a d'autres, oui elles seront de même nature. La définition de relique ne changera pas."
131,FAQ12-131,"Quand vous dites ""une relique est proche du mal jumeau"", c’est dans quel ordre de grandeur ? Mètres, kilomètres, centaine de kilomètres ?","Là-dessus, je répondrais pas."
132,FAQ12-132,La bonne mesure à trouver pour être de taille pour affronter le mal a eu a priori plusieurs valeurs au cours du temps. Y a-t-il un indice textuel dans le parchemin nous permettant de choisir la bonne de manière certaine ou bien devons nous faire toutes des suppositions jusqu’à avoir un ensemble très cohérent ?,"Alors je vous déconseille la dernière méthode. Il y a tout ce qu'il faut pour trouver la ou les bonnes mesures dans le jeu. Que ce soit dans les énigmes écrites ou dans les visuels. Donc là-dessus, pas de souci, tout est précisé."
133,FAQ12-133,Est-ce que la croix qui est sur une parcelle peut servir à autre chose qu’à la localisation de la parcelle ?,"Là-dessus, je ne peux pas répondre. Je ne peux pas vous confirmer qu'il s'agit d'une parcelle. Je vous laisse avancer."
134,FAQ12-134,Les lignes sur le sol de l'illustration quatre sont-[elles] en rapport avec une décoration de la chambre cachée ?,"Sur le lien, je répondrais pas. Tout ce que je peux dire à ce sujet, je crois que je l'ai déjà dit d'ailleurs, c'est que le quadrillage a en effet quelques particularités notables."
135,FAQ12-135,Les visuels nous aident-ils pour les lettres et phrases en rouge ?,"En partie, oui, tout à fait."
136,FAQ12-136,"Vous dites que l'eau a son importance car elle pourrait annuler un autre élément. Par annuler un élément, peut-on comprendre découvrir la révélation qu'a eu notre personnage en illustration six ?","Je ne pourrais pas dire en quoi, mais oui, l'eau a toute son importance."
137,FAQ12-137,"Si je vous disais que j'ai compris l'implication de l'eau dans le cadre de la chasse, que me diriez-vous ?",Je vous dirais bravo. Parce que ça veut dire vous avez beaucoup avancé et que vous vous rapprochez du coffre.
138,FAQ12-138,Est-il indispensable d'identifier toutes les reliques présentes dans cette chasse ?,"Ça me semble important, oui. Après, il n’y en a pas tant que ça. Donc c'était pas un travail trop difficile normalement."
139,FAQ12-139,La pièce de monnaie est-elle une pièce de la période antique ?,Je ne peux pas répondre à cette question.
140,FAQ12-140,Les WASP ont-ils une place dans la chasse ?,"Il peut y avoir des WASP utiles, mais pas parce qu'ils sont WASP. Si ça fait référence aux White Anglo Saxon Protestants."
141,FAQ12-141,"La connaissance (lierre) est-elle plutôt d'ordre pratique, spirituelle ou intellectuelle ?",Je dirais que c'est d'ordre intellectuel et éducatif.
142,FAQ12-142,"Une fois le lierre planté et qu’il s’est déployé, suis-je obligé de tout utiliser ou puis-je me concentrer uniquement sur une portion ?","Non, il faudra tout utiliser."
143,FAQ12-143,La direction générale du lierre va du bas vers le haut selon vos dires. Mais ce lierre cherche-t-il à monter au plus haut ? Peut-il partir complètement de travers sur la portion qui nous concerne ?,Le lierre passe par là ou vous l'obligez à passer. Si vous avez compris ce qu'il représentait évidemment.
144,FAQ12-144,"Je décide de faire une pause dans ma longue marche. Me conseilleriez-vous le zinc du bar le plus proche, un bureau d'étude à la bibliothèque, un guéridon instable dans le salon d’un inconnu, l'autel du temple local ou une table à manger familiale ?","Alors là, j'avoue, je ne sais pas trop quoi vous répondre. Les cinq lieux ont l'air très sympa, donc si c'est pour une pause, je serais tenté de dire un peu des cinq."
145,FAQ12-145,"Tant qu'à faire une pause, je vais lire un peu. J'hésite entre Perez Reverte, Dan Simmons, Newton, Umberto Eco, JK Rowling ou Borges. Un conseil ?",Umberto Eco et JK Rowling c'est très sympa aussi. Je tenterais plutôt ces deux là.
146,FAQ12-146,La connaissance est par essence même indissociable de l'idée de mouvement ou le mouvement est-il une possibilité mais pas une obligation ?,"Alors le mouvement, oui. Mais le lierre s'arrête de grimper à un moment. Voilà ce que je pourrais dire."
147,FAQ12-147,Un autre XX que celui de l'énigme trois me permet-il de confirmer la bonne pierre d'attente ?,Non.
148,FAQ12-148,"Lors d'une dernière FAQ, vous avez mentionné qu'une devise espagnole semblait utile dans la chasse. Était-ce une devise au sens littéraire ou monétaire ?","Là-dessus, je pourrais pas être plus précis."
149,FAQ12-149,Es-tu guénonien ?,"Oui, je suis allé voir ce personnage qui est assez fascinant et secret, comme le Comte. Donc on pourrait dire qu'il y a beaucoup de parallèles. Après, je ne pense pas qu'il soit parfaitement aligné sur les mêmes idées que Guénon."
150,FAQ12-150,Il semble y avoir un écart entre le symbole et le seuil de l'étrange porte du bâtiment de l'illustration cinq. Cette absence de raccord constitue-t-elle un oubli de l’illustratrice ?,C'est pas important.
151,FAQ12-151,Peut-on tenir entre nos mains l’objet qui se trouve dans la chambre cachée ?,"Ça, je pourrais pas vous répondre."
152,FAQ12-152,Et est-ce que l’objet de la chambre cachée se trouve toujours aujourd'hui dans la chambre cachée ?,Oui.
153,FAQ12-153,Le lierre semble être un ensemble de points reliés entre eux. Ces points ont sans doute un point commun. Ce point commun est-il donné par l’objet de la chambre cachée ?,Le point commun est intrinsèque à ce qu'est le lierre. Il n'y a pas de lien en particulier avec d’autres éléments.
154,FAQ12-154,"Puis-je affirmer que la circonscription de manifestation du mal jumeau de l’énigme trois confirme, volontairement ou pas, un des protagonistes du mal de l’énigme quatre ?","Alors je ne suis pas sûr d'avoir parfaitement compris cette question. Si vous voulez la préciser. Si vous entendez par circonscription une zone, une délimitation géographique, je dirais que non."
155,FAQ12-155,"Dois-je considérer le RC gravé dans la pierre du visuel un comme une signature artistique, une mention normative ou le résultat d'une action ?","Je dirais que ce qui se rapproche le plus, c'est une mention."
156,FAQ12-156,"Et au même titre que les cavaliers du jeu d'échec du visuel deux, pendant la partie du jeu de cartes du visuel trois, vais-je avoir l'honneur de rencontrer des figures historiques qui me seront utiles ?",C'est possible. Tout à fait.
157,FAQ12-157,La personne qui a les yeux clos dans la chambre cachée est-elle toujours aujourd'hui dans la chambre cachée ?,"Lorsque la chambre a été redécouverte, la personne n'y était plus. Mais il me semble qu'elle a été ensuite retrouvée."
158,FAQ12-158,Le mal jumeau est-il aligné avec la première relique et l'autre trésor ?,Oui.
159,FAQ12-159,Est-ce que la chambre cachée a un rapport avec la loge noire de Twin Peaks ? Et où est passé Chet Desmond ?,"Aucune idée. Je n'ai pas encore vu cette série, malgré tout le bien que j'ai pu entendre à son sujet. Donc je pourrais pas vous répondre."
160,FAQ12-160,"Imaginons la situation suivante: Suite au grand succès de la chasse, une nouvelle édition du parchemin est programmée. Afin de diminuer son impact environnemental, la nouvelle édition doit utiliser moins de papier et moins d'encre. Au delà de la diminution du format, le cahier des charges impose de supprimer des parties tout en permettant aux chasseurs de résoudre des énigmes et de trouver le trésor. Quelles parties peut-on supprimer ? Est-ce qu’il faut supprimer: A/ Le texte du testament, B/ Le poème, C/ L'énigme une, D/ L'un des visuels. Lequel ? E/ Autre chose ? F/ Pourrait-on imaginer une version noir et blanc ?","Vous auriez pu uniquement demander quelle partie il fallait supprimer, mais j'aime beaucoup le synopsis. On ne peut supprimer aucun bloc dans son entièreté. Je dirais qu’à la rigueur, et ça serait vraiment un grand maximum, deux/trois phrases dans l’ensemble des textes mais pas plus que ça. Quasiment 95 à 99 % des éléments et ce qui figure dans le cahier des charges pour les visuels est nécessaire. En tout cas, a un sens, a une incidence dans le jeu. Et s'agissant de la version noir et blanc, non surtout pas. Ou alors vraiment, la chasse devient complètement insoluble, mais ça serait inenvisageable."
161,FAQ12-161,"   Vous avez dit que la pièce était l’un des éléments les plus difficiles à trouver dans la chasse. Cette pièce est-elle remarquable par A/ Son visuel (avers et/ou revers), B/ Son matériau, C/ Sa masse, D/ Sa subdivision par rapport à une référence (100ᵉ 10ᵉ 12ᵉ), E/ Son importance historique, F/ Rien de tout cela ou G/ autre chose ?","Elle est remarquable de plusieurs façons. Oui, son nom, peut mettre la puce à l'oreille. Mais après il y a d'autres éléments qui doivent vous permettre de trouver la pièce."
162,FAQ12-162,Une nécropole devrait-elle attirer notre attention dans le cadre de la chasse ?,Je ne peux pas répondre à cette question.
163,FAQ12-163,Le lierre est-il le support de la connaissance ou est-ce le contraire ? A savoir la connaissance qui dirige le lierre ?,Je dirais que le lierre pousse sur la connaissance. C'est le rapport qu'il entretient avec la connaissance.
164,FAQ12-164,Le lieu familier nous fait-il découvrir d'autres reliques en lien avec le fil rouge ?,Je ne peux pas répondre à cette question.
165,FAQ12-165,"Le lierre a-t-il disparu car l'homme a fait des avancées, rendant la connaissance qu'il véhicule obsolète ?","Non, le lierre est toujours là."
166,FAQ12-166,"Les éléments éventuels qui nous aident à identifier les entités de l'énigme deux sont-ils d'ordre visuel ou sont-ils présents dans les énigmes ? Ou les deux ? Et une fois identifiés, avons-nous des éléments qui nous permettent aussi de confirmer notre identification ?",Je ne peux pas répondre à ces questions. Je pourrais uniquement dire que l'une des entités est sans doute plus dure à trouver que les autres.
167,FAQ12-167,"Le lien entre les entités de l'énigme deux et les cavaliers de l'échiquier existe et on doit le trouver. Sachant que les cavaliers de l’échiquier sont possiblement des villes, doit-on en priorité identifier les entités, de l’énigme deux pour trouver ces villes ?","Là-dessus, je pourrais pas répondre non plus."
168,FAQ12-168,"Durant les FAQs, quelles sont les questions qui vous agacent le plus ? 1/ Les questions inutiles, 2/ Les questions stupides, 3/ Les questions répétitives, 4/ Les questions à côté de la plaque, 5/ Les questions trollesques, 6/ Les questions avec des métaphores à la mords moi le nœud, 7/ Les questions à tiroirs, 8/ Les questions avec des sous entendus connivents wink wink, 9/ Les questions avec une longue liste d’une dizaine de propositions de réponses très fermées, 10/ Les questions sur la grappe que tout le monde aurait dû trouver il y a bien longtemps parce que bon c'est quand même que la première énigme nom de Dieu ! 11/ Obi Wan Kenobi","Aucune question ne m'agace. Elles ont toutes leur singularité, leur charme propre. Pour vous faire plaisir, je vous dirais que vos questions ont toujours un petit quelque chose en plus."
169,FAQ12-169,A l'intérieur de la terre: non naturel ? Fait par la main de l'homme ?,Je ne peux pas répondre à cette question.
170,FAQ12-170,L'échiquier me donne-t-il une mesure ou dois-je le comprendre en date ?,Aucun des deux. 
171,FAQ12-171,"Je pense avoir trouvé le milieu de l'échiquier à positionner sur ma carte. A ce stade du jeu, est-ce possible ?","Là-dessus, je ne peux pas répondre."
172,FAQ12-172,Vous parlez de finir littéralement par l'eau ou plus spécifiquement la lettre “O” ?,"Alors, non. Je parlais de l'eau, “l apostrophe e a u”."
173,FAQ12-173,L'Ordre nouveau me donne une figure de même ordre que je retrouve à l'endroit où je dois me rendre en finalité. Froid ? Chaud ? Joker ?,"Là-dessus, je peux pas répondre."
174,FAQ12-174,La Trinité. Trois époques ? Trois alliances ? Trois épées ? Y'en a-t-il un qui vous parle le plus ?,"La Trinité, c'est ce que Dieu veut tracer et c'est au féminin. C'est tout ce que je pourrais dire à ce sujet."
175,FAQ12-175,Les départements sont-ils encodés dans les illustrations ou est-ce trop récent ? Ou donc hors chasse ?,La réponse est non. Ça me semblerait anachronique et très difficile pour les non français de faire une crypto sur des départements.
176,FAQ12-176,"Énigme deux, était-il nécessaire que le parchemin de gauche avec une croix soit placé à côté des hiéroglyphes et des runes ?",Non pas nécessaire.
177,FAQ12-177,KV XX nous donne un peu d'air à fredonner ? Ou l'air est-il plutôt confiné ?,L'air est plutôt confiné.
178,FAQ12-178,J’ai parfois un peu de mal avec le sens des phrases en fonction de la position de la virgule. Est-ce que le mal jumeau est à l'Orient de l'autre trésor ?,"Ce qu'il faut comprendre là-dessus, c’est que le mal jumeau se voit par l'autre trésor. Tout cela se trouve à l'orient de la première relique."
179,FAQ12-179,"Puisque l'objet doit être présent dans la chambre cachée au moment où on y plante le lierre, cela veut dire qu'une interaction est demandée entre l'objet et la chambre cachée ?","Non. Par contre, il peut y avoir une interaction entre l'objet et les chiffres entre parenthèses."
180,FAQ12-180,"Concernant les lettres rouges du poème, avez-vous choisi les mots en fonction des lettres à faire apparaître ou inversement ?","Là-dessus, je ne pourrais pas répondre."
181,FAQ12-181,"Tout au long des énigmes, notre personnage ne fait qu'un seul déplacement au cours de l'énigme six. Pouvez-vous nous confirmer que le face à face, le combat final, a lieu sur ce trajet ?","En effet, lorsque vous rejoignez votre allié précieux, que vous êtes armé de votre force d'âme et de votre fidèle monture, vous êtes bien sur le lieu du face à face."
182,FAQ12-182,Les traces que l'on doit suivre sont-elles laissées par des êtres vivants ?,Peut-être pas s'agissant de la force d'âme.
183,FAQ12-183,"Les chiffres deux, cinq, trois, cinq, quatre, huit nous aident-ils, entre autres, à confirmer l'identité du lierre ?","Non, ils ne vous aident pas à ça."
184,FAQ12-184,Notre force d'âme  nous permet-elle de nous diriger ?,Je ne dirais pas ça non plus.
185,FAQ12-185,"Sur l’illustration trois,  lequel des deux personnages est arrivé en premier dans le trou ?",Il s'agit du personnage à droite.
186,FAQ12-186,"Avons-nous rencontré nos premiers guides: Petit A, lors de l'énigme une, à savoir au moment de tracer nos deux gardiens ? Petit B, lors de la lecture du testament, où le Comte énumère ses endroits parcourus ? Ou petit C, au moment du décryptage de la phrase de l'énigme deux ?","Là-dessus, je ne pourrais pas vous répondre malheureusement."
187,FAQ12-187,"Énigme quatre, nous découvrons le mal jumeau alors que notre personnage n'a pas récupéré son épée. Cela veut-il dire qu'il n'a jamais combattu contre le mal jumeau, ou pas encore combattu le mal jumeau ?","En effet, il faut d'abord voir le mal et le mal jumeau avant de pouvoir affronter le mal."
188,FAQ12-188,La Prusse est-elle une piste à investiguer ? Pouvez-vous nous confirmer qu'il n'y a aucun calcul à faire concernant les deux dates qui sont issues de la charade ?,"Là-dessus, les deux questions sont un peu trop précises. Donc je vais passer."
189,FAQ12-189,"Depuis la dernière FAQ, avez-vous eu le temps de procéder à une vérification du coffre et de l’élément de confirmation ?","Non, je n'en ai pas eu l'occasion. Après il y a toutes nos coordonnées dans le coffre et 100 000 € à gagner, donc ça m'étonnerait qu'il ait été découvert que la personne ne se soit pas signalée."
190,FAQ12-190,"Sur l’illustration six, l’oreille du cheval peut faire penser à une corne. Est-ce volontaire ?","Là-dessus, je ne peux pas répondre."
191,FAQ12-191,"Et maintenant que le cap un an est passé, quelqu'un commence-t-il à s'approcher de la zone finale ?","Là-dessus, du coup, j’ai donné les éléments sur les avancées des joueurs, donc oui ça avance bien."
192,FAQ12-192,"Selon vos dires, une relique se trouve près du mal jumeau. Cependant, est-ce au moment où on se trouve sur le lieu du mal jumeau qu'on doit s'en préoccuper ou doit-on remettre ça à plus tard ? Par s’en préoccuper, j'entends la rejoindre, l’utiliser, la porter, bref, interagir avec.","S'il y a vraiment des instructions d'utilisation, d'interaction, les énigmes vont le préciser. Vous n'aurez pas à le deviner."
193,FAQ12-193,Vous avez dit que le 3c64 ne sert qu'une seule fois. Est-ce aussi le cas pour 64 ?,"Là-dessus, je ne peux pas répondre."
194,FAQ12-194,"Sur plusieurs personnages évoqués dans les différentes FAQs, vous dites clairement qu'ils n'ont pas leur place dans l’Élixir. C'est assez catégorique comme réponse. Je me demande alors si lors de nos recherches il faut bannir toutes informations ou toutes trouvailles ayant un rapport, de près ou de loin, avec ces personnages. Aristote, Jean le Bon, Hermès Trismégiste.","Ce que je veux dire, c'est que ces personnages ne font pas partie des inspirations directes du jeu et que je ne me suis pas forcément renseigné. Pour certains, je ne les connaissais même pas. Donc ils peuvent avoir des thèmes, ils peuvent avoir exploré des idées qui se retrouvent de façon fortuite, proche des thèmes de la chasse. Mais ce sera de façon fortuite."
195,FAQ12-195,A-t-on vraiment besoin d'utiliser des outils pour déterrer le trésor ? Peut-on le faire à mains nues ?,"J'aimerais bien voir à mains nues, mais je vous conseille quand même plutôt d'utiliser des outils. Ça me paraît très compliqué de le faire sans."
196,FAQ12-196,"Est-ce un hasard si je trouve sur une même illustration, un lien entre un symbole, un lieu, et le titre d'une énigme ?","S’agissant des éléments dans le cahier des charges il n’y a pas de hasard. Donc si des éléments font sens et qu'il y a un faisceau d'indices convergents, c'est sans doute que vous êtes sur une bonne piste."
197,FAQ12-197,"Nous savons que l'affrontement doit se dérouler dans un lieu précis, mais doit-il également se dérouler à un moment précis, une époque, un mois, une heure de la journée ?",C'est une très bonne question et la réponse est oui.
198,FAQ12-198,"Et aussi, notre allié précieux est-il un enfant du pays où se trouve la zone de l’affrontement ?","Là pour le coup, par contre, je pourrais pas vous répondre."
199,FAQ12-199,Est-ce qu'un élément de l'illustration quatre nous aiderait à identifier l’arbre de l'illustration un ?,"Non, je ne crois pas."
200,FAQ12-200,"Le cheval du visuel cinq est-il un moyen de transport qui a échoué, entre autres ?","Je ne le définirais pas comme ça. Il a une utilité, mais ce n'est pas d'être un moyen de transport et encore moins d'échouer."
201,FAQ12-201,Les victimes possibles du mal et du mal jumeau sont-elles visées pour strictement les mêmes raisons et sont-elles interchangeables ?,Aucun des deux. Les victimes possibles ne seraient pas visées par les mêmes raisons et elles ne sont pas interchangeables.
202,FAQ12-202,Si je vous dis que les runes qui sont sur la feuille me donnent un dieu ou un animal en lien avec les hiéroglyphes suis-je dans le vrai ?,"Là-dessus, je ne répondrais pas."
203,FAQ12-203,Ce que l’on trouve avec le thé renversé a-t-il aussi un lien avec le lierre de la connaissance ?,"Non, pas directement. Il y a un lien, mais il n'est pas évident. Mais il y a un lien."
