,,Question,Réponse
96,FAQ10-96,Pouvons-nous intervertir les hommes et les cendres de l’énigme quatre et d'INRI sans que cela n'ait de conséquences? Le terme de cendres dans l’énigme 4 et INRI est-il à considérer au sens propre?,"Non, il ne s'agit pas des mêmes cendres. Et s'agissant des cendres ça a un sens assez morbide et primaire. Donc il va s'agir des restes d'êtres humains."
97,FAQ10-97,"Du cachemire, du fer et du jade font-ils référence à un engagement passé?","C'est une très bonne question. Et vous avez une remarque qui est très pertinente. Du coup, je vous dis bravo, mais je ne pourrais pas répondre à cette question."
98,FAQ10-98,Faut-il nécessairement avoir compris le fil rouge pour identifier nos premiers guides?,"Non, pas forcément, pas nécessairement à ce stade du jeu."
99,FAQ10-99,Plus ultra peut-il nous aider à porter notre regard au loin?,Non.
100,FAQ10-100,Quelle est votre énigme préférée et pourquoi?,C'est une bonne question. Je trouve que l'énigme que je préfère c’est la numéro six. Pourquoi? Parce que c'est une énigme qui est assez complète.
101,FAQ10-101,Est-ce que la rose des vents est liée à la grappe?,"Non, elle n’est pas liée à la grappe."
102,FAQ10-102,Le résultat de la charade nous donne-t-il un lieu directement? Ou est-ce que ce sont les différents éléments de la charade qui nous font déduire un lieu?,"Le résultat de la charade vous donne un résultat concret que vous pouvez directement utiliser dans le monde réel. Donc oui, tout à fait. Il peut tout à fait s'agir d'un lieu."
103,FAQ10-103,"Dans chaque item de la charade, les lettres peuvent-elles être interverties pour former une concaténation?","Non, les lettres sont données dans l'ordre."
104,FAQ10-104,"Dans INRI, vous répétez deux fois le mot “dernier” dans la même phrase. Une fois pour caractériser les rayons, une autre fois pour caractériser le jugement. Ne pouviez-vous pas éviter cette redondance?","Ça aurait été compliqué d'éviter cette redondance. Donc si j'avais pu trouver des synonymes à “dernier”, je l'aurais peut-être fait. Après, il fallait respecter aussi la structure d'un alexandrin. Donc je crois que pour ces deux raisons, ""dernier"" était le mot le plus approprié."
105,FAQ10-105,"Le choix que vous avez fait de mettre onze rayons plutôt que douze pour un soleil noir se justifie-t-il d'après un contexte a/ historique, b/ religieux, c/ folklorique, d/ rien de tout ça?",Je ne peux pas répondre à cette question qui est un peu trop précise.
106,FAQ10-106,Est-ce la relique ou le mal jumeau qui permet de regarder les hommes tomber?,Les hommes tombent à l'endroit du mal jumeau.
107,FAQ10-107,"Doit-on affronter le mal, puis le mal jumeau ou les deux ensemble?",Vous devez uniquement affronter le mal.
108,FAQ10-108,Faut-il parfois choisir le mal pour être sur la bonne voie?,Je ne peux pas répondre à cette question.
109,FAQ10-109,"Les “entités”, on va les appeler comme ça, de l’énigme deux ont-elles un point commun autre que leur fonction? Et cette fonction commune de nos trois entités est-elle à notre service ou à celui du personnage barbu?",Elles ont bien une fonction commune et elles ont des caractéristiques qui sont extrêmement communes au-delà de leurs appellations.
110,FAQ10-110,La relique de la charade est-elle actuellement visible ou a-t-elle été perdue dans le temps?,Cette relique a été déplacée. Je crois même dans l'histoire très récente. Mais elle n'est pas perdue. La relique n’a pas été perdue.
111,FAQ10-111,Est-ce qu'à un moment donné utiliser StreetView sur un lieu précis nous aide à nous guider vers la bonne direction comme un parcours fléché?,Non vous n’aurez pas besoin d'utiliser StreetView dans ce contexte là.
112,FAQ10-112,"Vous avez parlé de différentes grilles de lecture. Sont-elles thématiques? Et si oui, le fil rouge est-il transversal?","Oui, il y a plusieurs grilles de lecture. Oui, elles peuvent être thématiques. Et oui, le fil rouge est transversal."
113,FAQ10-113,4 lettres d’hébreu peuvent-elles faire une phrase interrogative?,Je ne sais pas.
114,FAQ10-114,"Lorsque jaillit l'ordre nouveau, nous invite-t-il a modifier un résultat précédent ou à explorer une nouvelle voie?","Lorsque jaillit l'ordre nouveau, vous ne pouvez pas le louper. Vous savez immédiatement de quel ordre nouveau il s'agit et il faut vous arrêter à cet endroit là. Et il ne s'agit pas d’un résultat précédent, je précise."
115,FAQ10-115,"Dans la charade, l'ordre des items a-t-il une influence sur le tout? Comme dans une charade standard?","Oui, tout à fait. "
116,FAQ10-116,Une carte est-elle utile pour résoudre la charade?,Non. Vous avez besoin d'une carte pour interpréter le résultat de la charade. Vous n'en aurez pas besoin pour trouver les six items.
117,FAQ10-117,Peut-on déduire le lieu de la charade sans trouver tous les items?,Oui.
118,FAQ10-118,Est-ce bien un volcan de représenté sur l'illustration trois?,"Non, il ne s'agit pas d'un volcan. Il s'agit d'une montagne."
119,FAQ10-119,"Pour voir le mal jumeau, faut-il se tenir à l'emplacement de la première relique?",Ça offre un très bon point de vue. Mais vous pourriez voir le mal jumeau depuis d'autres emplacements. Il se trouve qu’une relique est à proximité.
120,FAQ10-120,"1 - Dans le poème, “l'heur” des frères est-elle bien différente de “l’heur” de l'ami et cet ami fait-il partie des frères? 2 - “Quelle vie ! L’âme part... Ami, quand sonne l’heur ”","1 - Oui, c'est une heur différente et cet ami... Alors, si vous parlez de “chers amis”, qui sont les premiers mots du testament, cet ami ne fait pas nécessairement partie des frères. 2 - Non, il s'adresse à une audience un peu plus large à ce moment là du récit."
121,FAQ10-121,"Peut-on identifier le mal et le mal jumeau à travers différents aspects? A savoir minéral, végétal ou animal?","Non. Pour moi, c'est différent de ce que vous mentionnez."
122,FAQ10-122,"Les différentes reliques sont-elles complémentaires physiquement, contextuellement ou littéralement?","Elles sont complémentaires. Elles forment un tout qui est cohérent. Après, c'est à vous d'identifier la cohérence entre les reliques."
123,FAQ10-123,Le tracé pour relier les cendres voit-il son point d'arrivée rejoindre son point de départ?,Ça n'a pas d'importance. Vous pouvez le faire dans les deux sens.
124,FAQ10-124,Doit-on tourner notre regard en pèlerin sur la droite ou la gauche?,Je ne peux pas répondre à cette question.
125,FAQ10-125,"Sur le modèle de la phrase “Au Nord, du cachemire, du jade et du fer”, aurions-nous pu avoir par exemple “À l’Est, du muguet, du cuir et de la nacre”?","Je pense que oui, ça aurait été une possibilité pour une autre chasse peut-être. Mais en tout cas pour l’Élixir d’Or, c'est bien au Nord qu'il faut chercher à ce moment là du récit. Et c'est bien du cachemire, du jade et du fer qu'il faut identifier.
"
126,FAQ10-126,Y a-t-il qu’une seule pierre d'attente à trouver/utiliser dans la chasse?,Il n'y en a qu'une seule qui soit véritablement qualifiée de pierre d'attente.
127,FAQ10-127,La charade nécessite-t-elle l’aide d’un ou plusieurs visuels ou celle-ci est résoluble indépendamment?,On [peut] résoudre la charade sans avoir le reste des énigmes ou des visuels de l'Élixir d’Or.
128,FAQ10-128,"L’objectif de la charade est de nous faire trouver un lieu mais la concaténation ne donne pas ce lieu directement, n’est ce pas?","Exactement. Vous allez trouver, à vrai dire, un lieu mais qui n'est pas extrêmement précis. Et par contre, l'énigme dans son intégralité vous permet, une fois le lieu assez vaste trouvé, de localiser un lieu extrêmement précis et donc une relique."
129,FAQ10-129,La concaténation donne un nom propre qui une fois interprété nous permet de trouver un lieu et donc la relique?,"Oui, tout à fait. Il n'y a pas que cette concaténation qui vous est utile dans l'énigme."
130,FAQ10-130,Le lieu familier est un lieu très précis ou l’échelle d’une ville est suffisante?,"C'est un lieu très précis, c'est plus précis qu'une ville."
131,FAQ10-131,Les chiffres entre parenthèses de la chambre cachée servent-ils uniquement de confirmation ou l’information trouvée doit être utilisée?,Il ne s'agit pas d'une confirmation. Il s'agit de l'interprétation de la chambre cachée que vous avez trouvé.
132,FAQ10-132,La fleur qui est sur la croix dans INRI l’est-elle sur celle de l’énigme six ou sur celle que dieu veut d’INRI?,Elle n'est pas sur la croix de l’énigme six. Elle est sur la croix qui est mentionnée dans INRI.
133,FAQ10-133,"Le lieu familier semble relativement anecdotique, sert-il donc principalement à confirmer l’ordre nouveau?","Il vous donne en effet quelques indications sur l'ordre nouveau. Là-dessus, en effet, pour ceux qui ont trouvé le lieu familier, je pense qu'ils comprendront l'intérêt qu'il a pour trouver l'ordre nouveau. Et un peu plus loin également pour trouver le jaillissement."
134,FAQ10-134,Relier les cendres consiste en une droite ou une forme s’envisage également?,Il s'agit d'une droite.
135,FAQ10-135,"Les mals des énigmes deux, trois et six sont-ils symbolisés sur nos tracés par un même point?","Non, pas du tout."
136,FAQ10-136,L'autre trésor de l’énigme quatre nous permet-il d’être armé pour combattre le mal?,"En partie, mais ce n'est pas un trésor qui sera suffisant."
137,FAQ10-137,Est-ce que plusieurs éléments participants de la chasse sont inscrits au Patrimoine Mondial de l'Unesco?,"Là-dessus, je pourrais pas vous répondre. Je n’ai pas vérifié ça. Je me doute que oui."
138,FAQ10-138,"Concernant les hiéroglyphes et les runes, un aveugle de naissance aura-t-il plus de difficultés à les exploiter?",Il n'y a pas de braille qui se cache derrière les hiéroglyphes et les runes si c'est votre question.
139,FAQ10-139,"La plume et l'encrier sur le visuel à l'échiquier signifient-ils que la partie se déroule a/ à distance, b/ par analogie, c/ les deux?",Aucun des deux. Je ne pense pas que vous ayez bien compris ce qu’ils symbolisent dans le visuel numéro deux.
140,FAQ10-140,"“Planter le lierre de la connaissance” est-ce constructif a/ matériellement, b/ humainement, c/ spirituellement?","C'est constructif. Il est important de planter le lierre de la connaissance et de suivre le trajet que fait cette opération en effet. Après le lierre de la connaissance, c'est, en effet, plutôt une symbolique humaniste et spirituelle."
141,FAQ10-141,Le fait d'être né “roi ou fou pour faire ce que l'on veut” est-il incompatible pour “tracez ce que dieu veut”?,"Je pense que c'est incompatible, oui."
142,FAQ10-142,"Est-ce que, d'une certaine façon, le mal n'est identifiable qu'à moi, tout comme le mal jumeau n'est identifiable qu'à un autre que moi?","Non. Si vous êtes en capacité d'identifier le mal, vous êtes également en capacité d'identifier le mal jumeau en étant la même personne."
143,FAQ10-143,Donneriez-vous une fourchette du nombre de point à découvrir dans les six énigmes? Moins de 20? Plûtot 40? 100?,J'ai le chiffre exact en tête. Je ne pourrais pas vous le donner mais il est entre 50 et 150.
144,FAQ10-144,Est-ce que la relique a disparu?,Elle a été un moment disparue mais aujourd'hui elle n'est pas disparue.
145,FAQ10-145,Pour la charade un reliquaire peut-il être considéré comme une relique?,"Non, pas exactement. Une relique ça a une définition précise. Il ne faut pas que le reliquaire soit vide si vous voulez."
146,FAQ10-146,"Pour la première relique que nous devons trouver gràce à la charade, doit-on la trouver là où elle se situe actuellement ou là ou elle a été dans le passé?",Vous devez trouver là où elle se situe actuellement et il me semble que c'était le même endroit par le passé.
147,FAQ10-147,Peut-on trouver l'autre trésor avant la relique?,C'est une bonne question et la réponse est non.
148,FAQ10-148,"Et si à la fin, cela n'était finalement pas une évidence pour nous simples mortels. Que conseilleriez-vous? a/ prendre de la hauteur, b/ relire la très sainte trinosophie, c/ consulter un ophtalmo?","Je ne sais pas si c'est moi qui ait dit que c'était une évidence à la fin. C'est une évidence une fois qu’évidemment vous avez résolu et trouvé le lieu de la cache. Donc forcément, à ce moment là, vous avez fait 99 % du travail. Donc je dirais que c'est un peu avant ce moment là qu'il est important de prendre un peu de hauteur. Et puis après ça reste une chasse au trésor. Donc il y a une part de cryptographie, puis une part d'interprétation en fonction des éléments qui vous sont donnés par le Comte de Saint-Germain."
149,FAQ10-149,Dans l'énigme deux nous cotoyons le bien et dans l’énigme trois nous cotoyons le mal ou plutôt le châtiment pour le mal qui est ou fut en nous. Vrai?,"Alors dans l’énigme deux, et dans l’énigme trois, il n'y a pas de châtiment pour le mal. Vous allez voir un châtiment et c'est peut-être ce châtiment proprement qui peut être défini comme le mal."
150,FAQ10-150,"Pour ces énigmes, doit-on travailler avec des références courantes ou faut-il rechercher des références de l'époque du Comte?","Là-dessus, je le répète, il faut interpréter du coup le rapport au temps du Comte. Mais je pense que la plupart des informations qui sont dans le jeu sont des références de l'époque."
151,FAQ10-151,Est-ce un hasard si je note un certain humour des auteurs dans le choix des intervenants de la trois?,"De l'énigme trois? De l'illustration trois? En tout cas, si humour il y a, je ne sais pas. Il faudrait que vous m'explicitiez, je pourrais vous dire si c'était prémédité ou pas."
152,FAQ10-152,Le fait que le pion Plus Ultra de l'échiquier soit plus grand que les autres est-il une liberté de l'artiste?,"Je pense qu'il est un peu plus grand, mais parce qu'il est aussi devant. Il est représenté devant les autres pions noirs. Donc je pense que l'artiste a voulu tenir compte de la profondeur du dessin tout simplement. Mais je vous confirme que la taille du pion noir Plus Ultra est exactement la même que l'ensemble des pions.Que ce soit d'ailleurs les pions noirs ou les pions blancs. Et il est possible aussi que le pion noir Plus Ultra soit un peu plus grand pour l'artiste afin de lui permettre d'écrire et que ce soit lisible pour tous les mots “Plus Ultra”."
153,FAQ10-153,Les chiffres entre parenthèses sont-ils en lien avec la chambre cachée?,"Oui, tout à fait. Mais ils ne vous servent pas à confirmer la chambre cachée."
154,FAQ10-154,"Peut-on dire que le silence est d'or, mais que cette devise ne s'applique pas dans les faits à la chambre cachée?","Au contraire, je pense que dans la chambre cachée, il règne un grand silence."
155,FAQ10-155,"Dans le testament, les lettres “as” et la virgule du château d’Auzias ont une forme différente. Est-ce un style topographique ou doit-on y voir autre chose?","Je ne vois pas à quoi vous faites référence. Mais je ne pense pas que ça ait beaucoup d'importance. En tout cas, il n'y a pas de virgules qui soit normalement particulièrement importantes à noter."
156,FAQ10-156,"La pierre tombale avec RC, dessin numéro un, peut-elle indiquer autre chose que la sépulture d'un personnage?","Oui, tout à fait. Ça peut indiquer autre chose."
157,FAQ10-157,"J’ai remarqué plusieurs allusions temporelles dans le poème: “l’heur”, “l’aube”. Sont-elles à rapprocher du moment de la journée où se situent les illustrations?","C'est une très bonne question et, en effet, je vous invite à essayer de voir la chronologie des événements. Et surtout, en quoi il était important que certains événements se passent en plein jour et d'autres [pas]. J'aimerais même vous dire que la vérité ne peut éclater qu’au grand jour, si j'étais un peu aventureux dans ma réponse."
158,FAQ10-158,Le CSG aurait-il pu écrire le testament à une autre date que 1784?,Non.
159,FAQ10-159,Quelqu'un est-il enterré sous les racines de l'arbre?,Non.
160,FAQ10-160,Le personnage marche-t-il avec l'or qu'on voit?,Non.
161,FAQ10-161,L'arbre aurait pu avoir à la fois 10 branches et 3 racines?,"Oui, il aurait pu."
162,FAQ10-162,Je vois que les racines de l'arbre ont des ramifications. Ces ramifications sont-elles une liberté de l'illustratrice?,"J'ai simplement demandé à l'artiste que les racines soient visibles. Mais ces ramifications, dans leurs détails, ont été vraiment à la discrétion de l'illustratrice."
163,FAQ10-163,Y a-t-il un moyen de comprendre que la mesure du rapporteur est précisément de 18 degrés sans qu'on ait besoin de faire des mesures sur le parchemin?,"Oui, tout à fait."
164,FAQ10-164,"""Napoléon et la tranquillité"", ce n'est pas un sujet de philo, mais cela aurait-il pu constituer un fil vert valable?","Je ne sais pas comment répondre à votre question, mais je répondrais par acquit de conscience plutôt non. Bien que grand ""Napoléon maniaque"", il n'a pas beaucoup d'importance dans la chasse. J'aurais bien aimé."
165,FAQ10-165,"“Je me prénomme le Comte de Saint Germain”, si tel est le cas, devons-nous chercher son nom, ou bien auriez-vous pu écrire “Je me nomme” sans que cela ne change la chasse?","Je ne pouvais pas vraiment utiliser “je me nomme”. Je trouvais que “prénomme” était plus approprié dans ce contexte. Par la personnalité et par les origines aussi un peu confuses du Comte de Saint-Germain.
"
166,FAQ10-166,"Vous nous aviez dit que cette chasse nous invite à dépasser une certaine paresse intellectuelle, ma dernière question sur Napoléon [ndr: FAQ10-164] peut-elle rentrer dans cette catégorie de réflexion poussée ou faut-il aller encore plus loin dans les raisonnements?","Pour moi, il faut aller encore plus loin. Napoléon, c'est simplement explorer la piste d'un personnage célèbre de l'histoire. S'il ne faut trouver que des personnages, des lieux ou des moments célèbres de notre histoire. La chasse serait un peu trop simple."
167,FAQ10-167,"""Notre croix est à l'entrée du royaume des morts"", nous pouvons donc considérer que si l’on nous précise qu'il y a une entrée, il y a forcément une sortie?","En effet, on confirme que s'il y a une entrée, il y a une sortie."
168,FAQ10-168,"Si j'auscultais notre œil des ténèbres, lui diagnostiquerais-je une forme de loase? La loase: la filariose à loa loa est une maladie de l’œil provoquée par un ver nématode.","Merci d'apporter la définition. Donc, je n'ai pas de mots, je ne sais pas quoi vous répondre. Je pense qu'il n'y a pas besoin d’ausculter l’œil des ténèbres, en tout cas."
169,FAQ10-169,"Imaginons que nous jouions ensemble une chasse au trésor et que, via une énigme de celle-ci, nous devions trouver la lettre I majuscule ou L majuscule. Lors de notre avancée, le parchemin nous montre une barre horizontale à potentiellement ajouter à notre I sans que l’on nous précise de le tracer, ce qui nous donnerait au final un T. Prendriez-vous le parti de tracer cette barre, ou de garder le I en imaginant le T pour le reste de la chasse?","Je ne pense pas que le parchemin vous demande à un instant précis de tracer une lettre. En tout cas, ce ne serait pas l'esprit du tracé. Ça pourrait être une conséquence de plusieurs tracés que vous auriez effectués. Mais ce ne serait pas une instruction de la part des énigmes."
170,FAQ10-170,Dans l’indice kvxx fait-il référence à la chambre cachée?,"Là-dessus, je ne pourrais pas vous répondre."
171,FAQ10-171,"Notre personnage connait-il personnellement ses guides? Si non, ceux-ci peuvent-ils lui provenir du passé, présent et futur?",Il doit en tout cas apprendre à les connaître puisqu'ils vont le guider pour ses premiers pas. Ils peuvent provenir notamment du passé.
172,FAQ10-172,"Comment savoir quel type de lieue utiliser pour trouver le lieu familier? La lieue française de 4km? Celle de 4,445km ou celle de 4,82km?","Là-dessus, je n'ai pas donné la précision, donc c'est à vous de la trouver. Je ne pourrais pas vous vous dire quelle lieue il faut utiliser, mais, en effet, il faut faire un choix."
173,FAQ10-173,"Une fois la pièce de monnaie trouvée, confirme-t-elle l'emplacement de la chambre cachée?",Non. La pièce de monnaie trouvée ne concerne pas l'emplacement de la chambre cachée.
174,FAQ10-174,Un carat d’once d’or peut-on le trouver dans un tracé déjà effectué?,Non.
175,FAQ10-175,"""Ce que Dieu veut"" est une évidence?","Non, je ne pense pas que ce soit une évidence."
176,FAQ10-176,Si je suis digne dois-je comprendre d’office ce que j’ai à faire?,Oui.
177,FAQ10-177,"Y a-t-il une couleur, une seule couleur qui doit attirer mon attention et qui prend sens quand je dois tracer ""ce que Dieu veut""?","Il y a plusieurs couleurs, mais l'énigme vous explique évidemment dans quel ordre utiliser les couleurs."
178,FAQ10-178,Est-ce que vous auriez pu être un signataire de la déclaration d'indépendance ?,"[Le Comte de Saint-Germain] aurait pu être un signataire de la déclaration de l'indépendance des États-Unis, tout à fait. En tout cas, dans la légende et dans les histoires qu'il aurait pu raconter à la cour de Versaille, à la cour du roi de Prusse ou dans d'autres cours européennes."
179,FAQ10-179,Au terme du 33eme temps implique-t-il un calcul?,Non.
180,FAQ10-180,Pour finir la chasse devons-nous maitriser la gnomonique?,Non.
181,FAQ10-181,Trouver l’autre trésor nous rapproche-t-il de la chambre cachée?,Non.
182,FAQ10-182,Une fois la charade résolue devons-nous jeter les 6 items?,"Oui, vous pouvez les jeter."
183,FAQ10-183,"""Dans la gloire de l’œuvre"" ne veut pas dire à travers l’œuvre mais plutôt à travers un point sur le rayonnement de l’œuvre?",Ça veut dire à travers la réalisation de l'œuvre.
184,FAQ10-184,"Dans l'image quatre, est-ce que le crâne aurait pu être blanc au lieu de gris?","Oui, il aurait pu être blanc au lieu de gris. En tout cas, ça ne faisait pas partie du cahier des charges de l’illustratrice. J’ai simplement demander un crâne."
185,FAQ10-185,"Dans l'image une, est-ce que l'écorce de l'arbre peut s'avérer utile?",Non.
186,FAQ10-186,"Dans l'image une, est-ce que la tête bleue de l'oiseau aurait pu être d'une autre couleur?",Oui.
187,FAQ10-187,"Sur le visuel quatre, y a-t-il une boîte à musique?",Je ne crois pas non. Il n'y a pas de boîte à musique sur le visuel quatre.
188,FAQ10-188,"1 - Le nombre, la forme et la position de l'ensemble des diamants sur le sol visuel quatre auraient-ils pu être différents? 2 - L’agencement des ces éléments au sol résulte-t-il de la volonté de l’artiste?",1 - Le nombre: oui. La forme: oui. La position: pas forcément. 2 - En partie oui. Mais il y avait quand même certaines contraintes sur l'agencement des éléments. C'est d'ailleurs une très bonne remarque.
189,FAQ10-189,Vous avez laissé entendre qu’elles sont trinités et dévoilent le sépulcre d’azur se vérifient sur la zone finale mais avant de l’appliquer sur la zone finale avons nous également des tracés qui confirment l’ensemble des éléments d’INRI sur notre échelle préalable?,"Je dis “elles sont trinités”, ça ne se vérifie pas, non. Pour être tout à fait exact, le terme qui est associé à “Trinité” est un terme que vous ne pouvez trouver que vraiment à la toute fin du jeu. Et pour cette raison, je pourrais pas donner une réponse trop précise aujourd'hui. Peut-être plus tard, mais en tout cas la trinité et les éléments qui forment la trinité, à ce stade du jeu, je préfère vous laisser le soin de le décrypter par vous-même."
190,FAQ10-190,Est-il possible de trouver l'un de nos cavaliers sur le visuel quatre?,"Oui, c'est possible."
191,FAQ10-191,L’œil des ténèbres qui luit dans le noir pourrait-il être associé à un autre trésor ou à une relique?,"Non, ni un trésor, ni une relique. C'est même extrêmement éloigné d'un trésor ou d'une relique."
192,FAQ10-192,Est-ce que la grappe est liée à la relique?,Non.
193,FAQ10-193,Vous nous avez dit qu'il n' y avait pas de référence à la Chouette d'Or mais ce peut-il qu'une référence culturelle utilisée par la Chouette d’Or puisse être un élément de notre chasse?,"Oui, c'est possible. Le champ culturel utilisé par la Chouette d’Or, même sans toutes les pistes des chercheurs, est extrêmement vaste."
194,FAQ10-194,Le “O” et le “S” de l’énigme une donnent un seul bonus mais ont-ils besoin d'être assemblés pour être compris ou donnent-ils chacun un renseignement de nature différente?,Ils donnent chacun un renseignement qui est plutôt de nature différente.
195,FAQ10-195,Le bâton de notre personnage peut-il servir aussi à frapper?,"Non, il ne peut pas servir à frapper. Pour ça, il a un autre objet qui est également présent sur les visuels."
196,FAQ10-196,"Si un RC peut en cacher un autre, sont-ils de même nature?","Non, ils ne sont pas forcément de même nature."
197,FAQ10-197,Le mal et son jumeau ont-ils à travers les âges toujours eus les mêmes boucs émissaires?,"Oui, assez souvent en effet."
198,FAQ10-198,"Dans l'énigme trois, le lieu du mal que nous cherchons est-il visible par l'aigle facilement?",Oui.
199,FAQ10-199,Comprendre la signification de la fleur de lys du visuel un est-elle nécessaire à la bonne compréhension du visuel deux?,La fleur de lys ne vous sert pas dans l'interprétation du visuel deux. Elle vous sert autrement.
200,FAQ10-200,Les six énigmes de base respectent-elles la parité hommes/femmes?,"Malheureusement, je ne pense pas."
