,,Question,Réponse
204,FAQ12-204,"Énigme deux, l’endroit représenté dans le visuel est-il celui où vit la personne qui joue aux échecs contre le personnage barbu ?",L'endroit n'est pas important.
205,FAQ12-205,Les entités issues de l’énigme textuelle ont-elles toutes un rapport avec le vin ?,"Là-dessus, je ne pourrais pas répondre."
206,FAQ12-206,"Pensez-vous que le coffre sera déterré d'ici cinq mois ? C’est-à-dire avant novembre, en considérant que les chercheurs les plus avancés de votre sondage sont réellement les plus avancés tout court et qu'ils ne prendront pas de vacances cet été.","En toute honnêteté, je pense que la probabilité est faible. A moins que la personne la plus avancée ne soit rapidement rejointe par d'autres qui suivraient ses pas, ou qu’il y ait des échanges plus fort qui se fassent sur le Discord ou par message privé. Parce que je vois encore beaucoup de personnes qui n'ont pas des éléments importants des trois/quatre premières énigmes, alors qu'ils ont été parfaitement découverts par de nombreux autres. Donc en l'absence de ça, je ne pense pas. Ça me paraît peu probable. En tout cas, le calibrage est maintenu entre deux et cinq ans."
207,FAQ12-207,"Etienne, en initiant cette aventure, aviez-vous comme ambition cachée de devenir le Mozart des créateurs de chasses aux trésors ?","Mon ambition, c'est très simple, c’est de faire des chasses au trésor. Parce que c'est ma passion. Sur des thèmes qui m'intéressent, qui me passionnent. Pour le coup, sur l'Elixir, c'était la première, donc j’ai vraiment eu la liberté de choisir les thèmes qui me faisaient fantasmer, qui me faisaient rêver depuis très longtemps. Et ensuite de trouver des sponsors, en l'occurrence des domaines viticoles. Et puis sur les prochaines, forcément, c'est différent parce qu'on peut se faire approcher par des sponsors et donc les thèmes sont peut-être un peu moins libres, mais y’a toujours la possibilité de choisir un angle, un axe qui permet de rendre le sujet passionnant. L'objectif c’est de pouvoir en vivre aussi longtemps que possible."
208,FAQ12-208,Le personnage est droitier ou gaucher ?,"Ça ne vous sera pas utile, donc je pourrais pas répondre à ça."
209,FAQ12-209,Y a-t-il une confirmation en supplément du chemin nous conduisant à l'emplacement exact du coffre ?,"Oui. Il y a plusieurs confirmations de la zone, du pile poil, tout à fait."
210,FAQ12-210,À quoi correspondent les deux cercles jaunes que l’on peut apercevoir à côté du visage du sphinx au-dessus de l’étoile sous le drapeau rouge sur l’illustration quatre ?,C’est pas important. C’est une liberté de Mathilde également.
211,FAQ12-211,Est-il possible d’avoir un indice nous aidant à trouver les lettres rouges qui manquent ?,"Là-dessus, je le prépare pour le début de l'été. Je ne pense pas qu'il sera sur les éléments rouges, mais plutôt sur l'énigme cinq."
212,FAQ12-212,Est-ce que les phrases à trouver en rouge sont en latin ?,Je ne peux pas répondre à cette question.
213,FAQ12-213,Le combat final que nous livrons se déroule-t-il environ 100 ans après le 33ème temps ou aujourd’hui ?,Je ne peux pas répondre à cette question.
214,FAQ12-214,Avons-nous une indication pour savoir comment le Comte a découvert l'Élixir d'Or ? Combien de temps cela lui a pris ? Si quelqu’un l’a aidé comme il nous aide ?,"Oui, tout à fait. Vous avez des indications sur l'origine du secret de l'immortalité du Comte et qui l’a aidé au passage. En effet, c’est dans le parchemin."
215,FAQ12-215,"Lorsque l’esprit survole la matière, la vérité est-elle au cœur ?","Bonne question, je ne suis pas philosophe. Donc je ne pourrais pas vous dire. L'esprit et la matière sont à égalité, s'alimentent mutuellement, mais je ne pense pas que je pourrais pousser plus loin la réflexion."
216,FAQ12-216,"Au moment où tout semble converger, mais où tout semble aussi nous échapper, qu'est ce qui doit nous guider ?",Le fil rouge doit vous guider au moment charnière.
217,FAQ12-217,"Vous avez dit que les terres visibles sur la mappemonde du visuel deux étaient le fruit de la liberté de l’artiste. Cela veut-il dire que le cahier des charges n’indiquait strictement aucun élément ni consigne sur ce qui se trouvait dessiné sur le globe ? Ni zone, ni trait, rien ?",Je vous confirme en effet qu'il n'y avait pas d'indication particulière sur cette mappemonde. Donc il ne servira à rien d'essayer de trouver des indices dessus.
218,FAQ12-218,Est-ce que Novus Ordo est le bon ordre ?,"Ce n'est pas forcément le bon ordre, mais en tout cas c'est le nouveau. Il faut l'interpréter comme tel."
219,FAQ12-219,Le début du testament nous aide-t-il à la fin ?,"Oui, en partie."
220,FAQ12-220,"Rassurez-moi, le minuscule coffre de ma chariotte suffira-t-il pour transporter le coffre ?","Alors le coffre est grand. C'est un bon coffre de pirate on va dire. Mais ce n'est pas non plus une malle. Donc a priori, oui."
221,FAQ12-221,Est-ce que les lettres rouges de l’indice un nous aident à trouver la crypto qui permet de trouver d’autres lettres rouges dans le poème ?,Elles vous donnent une indication sur ce que vous devez trouver. Voilà comment il faut les interpréter.
222,FAQ12-222,"Si nous creusons de nuit, comment la lumière peut-elle nous guider pour le premier coup de pelle ?","Vous pouvez aller creuser par tout temps, à n'importe quelle heure du jour ou de la nuit, ça n'aura pas d'incidence."
223,FAQ12-223,Pouvons-nous considérer que les lettres “plus ultra” sont en rouge ?,"Elles ne sont pas en rouge. Elles sont plutôt violettes. En tout cas, pas la couleur rouge."
224,FAQ12-224,"Suite à des propositions de solutions, un chasseur est-il proche du coffre à moins de 50 mètres ?","Là-dessus, je ne peux pas vous répondre."
225,FAQ12-225,Comment séparer le grain de l'ivraie pour avoir un cœur accompli ?,Il ne faut pas dévier de son fil rouge.
226,FAQ12-226,"En terme de profondeur, est-ce le dessus du coffre qui est à environ à 60 cm de profondeur ?",Oui.
227,FAQ12-227,"Quand vous employez la notion de “zone finale”, sous-entendez vous qu'elle contient à la fois le lieu du combat final et le pile-poil ?","Oui, tout à fait."
228,FAQ12-228,"Une fois le dernier cercle tracé et le mal trouvé, peut-on considérer qu'il ne sert plus à rien et l'effacer ? Ou est-il préférable de garder ce cercle visible ?","Non, il ne sert plus à rien par la suite."
229,FAQ12-229,"Dans l'indice, les chiffres entre parenthèses indiquent à quelle énigme chaque paragraphe fait référence. Pour KV XX pouvons-nous considérer qu'il fait référence à une énigme qui n'est pas évoquée avant ?","Pour KV XX, ce n'est pas précisé, mais vous ne pouvez pas exclure non plus que ça puisse faire référence à une des énigmes mentionnées avant."
230,FAQ12-230,La force d’âme a-t-elle un rapport avec l’amour des reines ? Ou est-ce qu'il y a un rapport avec la flamboyance de mon épée ?,"Ce que je peux vous dire par rapport à force d'âme, c'est qu’elle vous est connue à ce moment là. Si vous avez le bon fil rouge et qu'un élément de confirmation extrêmement fort viendra vous confirmer dans cette piste."
231,FAQ12-231,Quelles sont les dimensions du coffre ?,"Je n'ai pas pris de photos donc je ne pourrais pas vous dire précisément. Mais je dirais qu'il fait 60 cm, 70 cm, peut-être de longueur, 20 cm de profondeur, et puis 30 de haut environ."
232,FAQ12-232,"Selon vous, un enfant de dix ans peut-il déterrer le coffre ?","Je ne pense pas. En tout cas, sauf s’il est très puissant pour son âge, il mettra pas mal de temps je pense."
233,FAQ12-233,"Est-il possible que votre élément de confirmation sur place ait été enlevé, déplacé ou recouvert par la végétation ?","Non, aucune chance."
234,FAQ12-234,Les illustrations peuvent-elles nous inviter à réaliser des tracés sur la carte ?,Je ne peux pas répondre à cette question.
235,FAQ12-235,"Le lierre de la connaissance a-t-il un lien avec le Nord du cachemire, du fer et du jade ?",Non.
236,FAQ12-236,"Sur la zone de combat, notre fidèle allié agit-il comme un coach ou plutôt comme un compagnon d'armes ?",Je dirais qu'il agit en effet plutôt comme un compagnon d'armes.
237,FAQ12-237,"Énigme un, cerner les contours de la grappe sur une carte pourrait-il être utile à un moment donné ?","Non, ça me paraîtrait très compliqué de le faire."
238,FAQ12-238,"Énigme trois, vous avez dit “La tombe du visuel trois, en elle-même, n’est pas à identifier. mais elle vous donne un élément important pour la suite, où le côté symbolique est le plus important. Mais il s'agit bien d’une tombe et il est important de comprendre de quelle tombe il peut s'agir”.","Je vous l’accorde, la réponse est pour le moins confuse. Ce que je voulais dire, c'est que l'identification de la personne de la tombe ne vous donnera pas une solution importante, contrairement à la tombe en elle-même. Mais par contre, en trouvant la personne, vous trouvez la tombe en conséquence. Et ça, ça peut être important."
239,FAQ12-239,"Je reviens sur la réponse concernant le mal jumeau et l’autre trésor. Je me place à l'orient de la relique, et à travers l'autre trésor, je regarde vers la relique. Dit autrement, l'alignement est-il relique, autre trésor, mal jumeau ? Ou bien relique, mal jumeau, autre trésor ?","Dit autrement, l’alignement est relique, autre trésor, mal jumeau. Comme ça, c'est clair."
240,FAQ12-240,Certains événements en rapport direct avec la chasse ont-ils pu défrayer la chronique aux différentes périodes dans lesquelles s'inscrivent les énigmes ?,"Oui, certains événements ont été majeurs et ont défrayé la chronique. Tout à fait. Et même après les événements de la chasse, avant de lancer la chasse, certains événements se sont déroulés."
241,FAQ12-241,"25 35 48 auraient-ils pu être remplacés par six autres chiffres dont toujours avec un en double ? Par exemple, dans 25, 35, 48, il y a le cinq qui se répète deux fois.",Ça n'aurait pas pu être d'autres chiffres.
242,FAQ12-242,"La lueur produite par l'œil des ténèbres affaiblit-elle, révèle-t-elle ou renforce-t-elle quelque chose ?","La lueur n'a pas d’action en elle-même. Mais ce qui compte, c'est de savoir de quelle lueur il s'agit."
243,FAQ12-243,L'œil des ténèbres et le lierre de la connaissance s'opposent-ils ou se complètent-ils ?,Ils n'ont pas de lien de prime abord. Je dirais pas qu'il y a de lien d'opposition ou qu’ils se complètent.
244,FAQ12-244,"Les ténèbres regardent-ils: au plus loin, au plus près, en profondeur, en surface ?",L'œil des Ténèbres vous regarde.
245,FAQ12-245,"Dans la deuxième strophe du poème, l'homme y verra-t-il net après n'y avoir vu goutte, ou que du feu ?",C’est une très bonne question. Et je dirais que l'homme y verra net après n'y avoir vu que du feu.
246,FAQ12-246,"Les lettres du mot “FIN” pourraient-elles se décliner ainsi : F comme fixation et/ou fermeture, I comme ignition et/ou initiation, N comme numération et/ou normalisation ?","J'ai beaucoup aimé les deux premières propositions pour F et I, donc je pourrais accepter les deux premières, moins la troisième."
247,FAQ12-247,"Pour gagner notre combat contre le mal, voire réussir notre quête, nous conseillez-vous plutôt d’avoir une mémoire sélective, une mémoire collective, pas de mémoire ou la mémoire du cœur ?",Je pense pas que ce soit une notion de mémoire. Je pense que vous n’avez pas besoin d’avoir beaucoup de mémoire dans la chasse ou en tout cas au moment crucial de combattre le mal. Je dirais plutôt qu'il s'agit d'avoir très bonne idée.
248,FAQ12-248,Est-ce qu’identifier ou faire le bien peut aider à localiser le lieu de l'affrontement ?,"Oui, en partie. Mais, c'est vraiment très concret. C'est de trouver votre allié, et de bien choisir la monture et la force d'âme que vous prenez."
249,FAQ12-249,Trouveriez-vous ma question un peu trop alambiquée vous demandant si l'eau avait pour effet de troubler le mal ?,Je ne dirais pas l'eau trouble le mal. Je ne pense pas qu'il y ait une opposition aussi forte entre les deux.
250,FAQ12-250,"Question gourmandises. [Si] le Comte de Saint-Germain était pâtissier, lequel des gâteaux suivants aurait sa préférence : une religieuse, un jésuite, un diplomate ou un gâteau de Savoie ?",J’exclurais le jésuite. Le gâteau de Savoie je répondrais pas. Et religieu[se] et diplomate sont très intéressants oui.
251,FAQ12-251,Les affirmations suivantes pourraient-elles s'inscrire dans la chasse : L'ennemi de mon ennemi est mon ami ou un moindre mal est parfois nécessaire ?,"La première je dirais que non. Alors ça dépend à quoi vous faites référence. Je pense intuitivement à l'allié précieux. Et l'allié précieux ne vous aide pas parce que vous avez un ennemi commun. Il vous aide vraiment parce que c'est un allié précieux sur lequel vous pouvez compter. Voilà ce que je pourrais dire. La deuxième partie, oui tout à fait."
252,FAQ12-252,1 - Nous savons que l'affrontement n'est pas une histoire de revanche. Mais est-il une vengeance et est-il pour rétablir l'équilibre entre le bien et le mal ? 2 - Et pas l'équilibre ? ,1 - Ce n'est pas une vengeance c'est un combat essentiel. Il porte en lui-même quasiment une finalité propre. 2 - Pas nécessairement non.
253,FAQ12-253,Peut-on considérer qu’ils se situent tous sur la même ligne du coup ? [ndr : relique - autre trésor - mal jumeau],"Mécaniquement, en effet, si vous voyez le mal jumeau par l'autre trésor depuis la relique, je vous laisse faire les conclusions qui s'imposent."
254,FAQ12-254,Vous avez précisé que le testament contenait des indices pour la pièce lors d'une précédente FAQ. Entendiez-vous par testament le parchemin au global ou bien le premier texte du parchemin avant les énigmes et les illustrations ?,"Je parlais de l'introduction [du parchemin] qui contenait des indices, mais évidemment d'autres indices, peut-être même plus importants, se déroulent une fois les énigmes commencées."
255,FAQ12-255,"Dans KV XX, les deux X représentent-ils la même chose ? Ou bien KV XX sert juste à nous aiguiller vers quelque chose ?","Alors je ne pourrais pas vous dire si les deux “X” sont la même chose. Par contre, en effet, on peut dire que les deux “X” sont de même nature."
256,FAQ12-256,"On va faire un petit parallèle entre l’Élixir d’Or et la cuisine. Imaginez qu'on compare le parchemin à des pâtes à la carbonara. Utiliser un peu de crème, est-ce que c'est sacré ou profane ?","Non, c'est pas profane. Pour moi ça peut-être important."
257,FAQ12-257,"Concernant le texte rouge, la découverte est l'utilisation d'éléments rouges, qu'ils soient nouveaux ou déjà visibles, peut-elle raisonnablement se faire en début d'aventure ?","Oui, tout à fait. Les éléments rouges peuvent être trouvés dès le début du jeu."
258,FAQ12-258,"En tant qu'alchimiste, vous connaissez sûrement la célèbre maxime attribuée à Antoine Lavoisier “Rien ne se perd, rien ne se crée, tout se transforme”. A quel point la trouvez-vous appropriée à la quête de l'Élixir d'Or ?","Je la trouve très approprié à la quête de l’Élixir d’Or, puisque, en effet, plusieurs éléments au cours du jeu peuvent avoir des interprétations et des réponses différentes en fonction du stade où vous vous trouvez dans le jeu."
259,FAQ12-259,"Les grilles de lecture donc, qui ont été citées précédemment en FAQ, sont-elles toutes à extraire d'éléments de même catégorie ? C'est-à-dire soit toutes des énigmes, soit toutes des illustrations, soit du poème, etc.","Non, on va pas utiliser les mêmes grilles de lecture pour des illustrations et du texte. Alors ça, ça me semble important. Après, quand on va apposer des schémas de pensée, qu'on va poser un cadre de réflexion, un cadre de recherche documentaire, oui, là, il peut y avoir une vision commune, qu'on va interpréter, des solutions intermédiaires ou des solutions finales d'énigmes ou d'illustrations."
260,FAQ12-260,"Est-ce que les grilles de lecture au sens propre du terme, cela peut vous parler en terme de décryptage ?","J’avoue je réfléchis pas en terme de grille de lecture. Je réfléchis plutôt à dresser une architecture globale, une carte mentale. C'est pour ça que je prenais la métaphore du puzzle qui me semble très appropriée. Et à partir de plusieurs cryptos que vous arrivez à décrypter, et bien progressivement, vous avez cette carte qui prend forme. Et c'est un tableau à recomposer."
261,FAQ12-261,La quantité de cire fondue des bougies peut-elle nous donner une indication utile en dehors du fait que le personnage a passé un certain temps dans cette pièce ? Et donc les bougies auraient-elles pu être au même niveau ?,"Pas d'importance là-dessus. En effet, les bougies auraient pu être de même niveau. Elles reflétaient surtout le fait que le personnage travaille à une heure avancée de nuit et qu'il passe beaucoup de temps sur cette partie d'échecs."
262,FAQ12-262,Est-ce que vous faites une différence entre bougies et flambeaux ?,"Oui, je fais une différence entre bougies et flambeaux."
263,FAQ12-263,Les hommes qui tombent sont-ils irréprochables ?,Je pense que les historiens ne sont pas d'accord sur ce sujet là. Je vais vous donner mon avis subjectif. Je pense les personnes qui tombent sont plutôt des personnes vertueuses.
264,FAQ12-264,"Vous avez répondu sur le cachemire, le fer et le jade que c'était une très bonne question, une remarque très pertinente mais vous ne pouviez pas répondre à cette question, voilà pourquoi ma question de tout à l'heure. Nous avons trois références à un engagement passé. Pourrait-il y en avoir un quatrième ? Pouvez-vous répondre aujourd'hui ?",J'ai répondu que je ne pouvais pas répondre.
265,FAQ12-265,"Est-ce que l'énigme deux a un rapport avec une région française, voire un département précis ?","Là-dessus, pareil, je peux pas répondre, ça donnerait un peu trop d'indications."
266,FAQ12-266,"Peut-on dire que notre personnage, pendant son périple, est l'homme qui mourut de s'être vu monter plus haut que Roi ?","Non, on ne peut pas dire ça."
267,FAQ12-267,Le soleil de l'illustration une va-t-il se retrouver dans le temple de l'illustration cinq ?,"Non, il ne s'agit pas du même soleil."
268,FAQ12-268,A quel moment est-il important de se repencher sur la grappe ?,Je ne pourrais pas répondre à cette question malheureusement.
269,FAQ12-269,"Comme source d'inspiration vous avez précédemment mentionné un livre qui n'est pas un roman. S'agit-il d'un essai ? Et si oui, a-t-il été publié par une maison d'édition appréciée des initiés ?","Là-dessus, je ne pourrais pas répondre non plus. Mais explorez toutes les pistes que vous pouvez avoir."
270,FAQ12-270,"Mon premier qui est bâtisseur, est-il un maître bâtisseur ?","Je ne peux pas dire si c'est un maître, mais je peux dire qu'il est de confiance, qu'il est de bon aloi. Ça devrait vous suffire."
271,FAQ12-271,Le scorpion du visuel quatre aurait-il pu se trouver sur le visuel trois ?,Je ne peux pas répondre non plus à cette question malheureusement.
272,FAQ12-272,"En FAQ 7, vous avez dit “une pierre d'attente peut vous guider” puis en FAQ 11, “la pierre d'attente, c'est une étape intermédiaire et elle ne possède pas de finalité propre”. N’y a-t-il pas un paradoxe ?","Non. C'est-à-dire que la pierre d'attente peut vous guider vers justement une étape plus finale. Et donc elle n'a pas, en effet, de finalité propre en elle-même. Elle ne vous sert pas, ce n'est pas un élément crucial du jeu."
273,FAQ12-273,Potentiellement une vieille grappe toute pourrie subsiste-t-elle à côté de LA grappe ?,Je sais pas si il y a une vieille grappe toute pourrie à côté de la grappe. J'imagine que oui. Il doit y avoir des bouts de raisins un peu pourris à côté.
274,FAQ12-274,"Pour revenir à la dernière FAQ, vous nous avez affirmé avoir visité vous-même la chambre cachée. Pouvez-vous le confirmer ?","Alors je me souviens pas du tout d'avoir affirmé ça. Mais ça m'étonne beaucoup. Je pourrais pas répondre à cette question, mais je ne pense pas avoir affirmé ça. Ça me paraîtrait un peu audacieux."
275,FAQ12-275,"L’allié précieux nous fait-il grandir ou plutôt grossir, alors que nos ennemis, ou plutôt concurrents, pourraient tenter de vivre à nos dépens ? Tout est-il question de partage ?","1 - Oui. L'allié précieux vous fait grandir. Il vous tire vers le haut, quasiment au sens propre. Et donc il est, à ce point de vue, extrêmement important. Mais c'est important aussi que vous puissiez faire le pas vers lui. 2 - Je ne dirais pas que vos ennemis ou concurrents pourraient vivre à vos dépens. Je dirais plutôt qu'ils essayent de mettre fin à votre existence. C'est beaucoup plus manichéen. Voilà ce que je pourrais dire. Sur la question de partage, j’ai dit que c’était dans les deux sens. A la fois l'allié qui venait vers vous et vous qui veniez vers l'allié."
276,FAQ12-276,Est-ce que je rencontre ou croise mon allié précieux avant d'en avoir réellement besoin ?,"Non, c’est une rencontre qu’on pourrait qualifier d'inédite."
277,FAQ12-277,Trouverons-nous un arbuste comme indice pour le premier coup de pelle ?,"Là-dessus, je ne peux pas vous répondre, bien évidemment. C’est un sujet très très très touchy."
278,FAQ12-278,Les trois grappes d'or chevauchent-[elles] dans la même direction que trois chevaliers guides ?,"C'est une bonne question, et là-dessus, je ne peux pas vous répondre."
279,FAQ12-279,Est-ce que le nouvel ordre était contemporain du Comte ?,"C'est une bonne question, mais je pourrais pas vous répondre par oui ou par non."
280,FAQ12-280,"Sur le final, le soufre alchimique nous permet-il de définir une zone de sol meuble où on peut être tenté de creuser.",Ça peut être une possibilité parmi d'autres. Je peux vraiment donner aucune indication sur le lieu final.
281,FAQ12-281,Quelles sont les confirmations pour la zone ?,"Donner une indication, ce serait révéler en partie le fil rouge et révéler des informations très très importantes dans le jeu."
282,FAQ12-282,"Dans l'esprit, est-ce que l'impression d’une illustration sur un papier calque à une échelle appropriée pourrait-elle être une idée impossible, farfelue, essentielle ou possible ?","Alors j'aurais adoré mais pour les besoins d'avoir une version digitale, malheureusement, selon les écrans ce ne sont pas les mêmes proportions. On pourrait imaginer uniquement ça sur des calculs d'angles qui pour le coup ne changent jamais selon les supports sur lesquels on peut lire les énigmes et les illustrations."
283,FAQ12-283,"Dans l’énigme cinq, on doit trouver le Prince des vignes et l'évêque universel. Deux endroits donc. A-t-on dans un des visuels ou ailleurs sur le parchemin un indice nous permettant d'avoir une confirmation de ces deux lieux ?","Les deux lieux sont assez faciles à trouver. Je pourrais pas vous dire exactement où se trouvent des confirmations ou des indices, mais ce n'est pas le plus dur à trouver. Les deux lieux ont été trouvés par de nombreux joueurs."
284,FAQ12-284,L'agencement des gouttes rouges autour du calice du visuel quatre font partie du cahier des charges ?,"Non, ça ne faisait pas partie des cahiers des charges d’avoir des gouttes qui éclaboussent autour du calice. Donc je dirais que non."
285,FAQ12-285,"Sur le visuel un, la carte à priori qui montre une zone plus précise, une région selon vous, n'aurait-elle pas un lien avec la crypte du visuel quatre ?","Non, il n'y a pas de lien entre les deux."
286,FAQ12-286,Mon allié précieux et ma fidèle monture pourraient-ils avoir un lien de parenté ?,"Là-dessus, je pourrais pas vous répondre."
287,FAQ12-287,Les hommes qui tombent tombent-ils pour la même cause et à la même époque ?,"Non, ils ne tombent pas pour la même cause. Par contre, ils tombent, on peut le dire, à une époque assez proche."
288,FAQ12-288,"On m'a laissé trois jours dans un sarcophage, j'en ai compris des choses. Cela vous parle-t-il ?","Non, ça me parle pas, désolé."
289,FAQ12-289,"L'illustration quatre contient de nombreux éléments qu'on peut relier à différents lieux. Or, dans la FAQ précédente, vous disiez que cette illustration nous permettrait d'identifier un lieu réel. Y a-t-il quelque chose qui pourrait nous permettre de trancher, de choisir le bon lieu avec certitude ? Ou bien peut-on imaginer que cette salle au trésor représente plusieurs lieux à la fois ?","Cette illustration permet d'identifier un lieu réel, en effet. Mais ce qu'il y a à l'intérieur est suffisamment riche pour élargir à d'autres pistes, d'autres solutions, évidemment."
290,FAQ12-290,"L'ordre Labastide Orliac, Auzias et Villegeorge aurait-il pu être autre ?","Il aurait pu être dans le sens inverse, mais c'est tout."
291,FAQ12-291,"Vous avez dû apporter une correction de FAQ en disant qu'il était important de connaître l'emplacement de la relique à la période de rédaction du testament, soit 1784. Ok pour cette précision. Du coup, est-ce valable aussi pour d'autres éléments ? Certaines valeurs fluctuant avec les périodes, valeurs des métaux par exemple.","C'est valable également pour d'autres éléments. Tout à fait. Notamment s'agissant par exemple d'une pièce, la valeur qu'il faudrait prendre en compte serait celle au moment où la pièce était évidemment en circulation."
